word,summary,read,mention,href,link,time_stamp
你的青春里有灌篮高手吗,你会去打卡电影《灌篮高手》吗？,1945081,3116,https://m.weibo.cn/api/container/getIndex?containerid=231522type%3D60%26q%3D%23你的青春里有灌篮高手吗%23%26t%3D10&title=%E7%83%AD%E9%97%A8-%23你的青春里有灌篮高手吗%23,https://s.weibo.com/weibo?q=%23你的青春里有灌篮高手吗%23,2023-04-20 22:55
一直不谈恋爱能等到更好的人吗,你因为什么一直不谈恋爱，你觉得一直不谈恋爱能等到很好的人吗？,128133444,8500,https://m.weibo.cn/api/container/getIndex?containerid=231522type%3D60%26q%3D%23一直不谈恋爱能等到更好的人吗%23%26t%3D10&title=%E7%83%AD%E9%97%A8-%23一直不谈恋爱能等到更好的人吗%23,https://s.weibo.com/weibo?q=%23一直不谈恋爱能等到更好的人吗%23,2023-04-20 22:55
杭州公布色狼完整姓名合适吗,大象评杭州公开色狼处罚结果：指名道姓用力过猛了。,428608164,26987,https://m.weibo.cn/api/container/getIndex?containerid=231522type%3D60%26q%3D%23杭州公布色狼完整姓名合适吗%23%26t%3D10&title=%E7%83%AD%E9%97%A8-%23杭州公布色狼完整姓名合适吗%23,https://s.weibo.com/weibo?q=%23杭州公布色狼完整姓名合适吗%23,2023-04-20 22:55
男生真的会爱一个人很久吗,你觉得爱是一成不变的吗，真的会有人一直喜欢一个人很久很久吗？,9053285,3759,https://m.weibo.cn/api/container/getIndex?containerid=231522type%3D60%26q%3D%23男生真的会爱一个人很久吗%23%26t%3D10&title=%E7%83%AD%E9%97%A8-%23男生真的会爱一个人很久吗%23,https://s.weibo.com/weibo?q=%23男生真的会爱一个人很久吗%23,2023-04-20 22:55
承受不住压力离职是种失败吗,因为承受不住压力而离职，是一种失败吗？,35770150,2972,https://m.weibo.cn/api/container/getIndex?containerid=231522type%3D60%26q%3D%23承受不住压力离职是种失败吗%23%26t%3D10&title=%E7%83%AD%E9%97%A8-%23承受不住压力离职是种失败吗%23,https://s.weibo.com/weibo?q=%23承受不住压力离职是种失败吗%23,2023-04-20 22:55
牺牲生活质量的攒钱有必要吗,大象评牺牲生活质量的攒钱有必要吗：没有参考意义,84052646,3509,https://m.weibo.cn/api/container/getIndex?containerid=231522type%3D60%26q%3D%23牺牲生活质量的攒钱有必要吗%23%26t%3D10&title=%E7%83%AD%E9%97%A8-%23牺牲生活质量的攒钱有必要吗%23,https://s.weibo.com/weibo?q=%23牺牲生活质量的攒钱有必要吗%23,2023-04-20 22:55
谷雨该吃啥,谷雨该吃啥，一起来分享。,29940126,90015,https://m.weibo.cn/api/container/getIndex?containerid=231522type%3D60%26q%3D%23谷雨该吃啥%23%26t%3D10&title=%E7%83%AD%E9%97%A8-%23谷雨该吃啥%23,https://s.weibo.com/weibo?q=%23谷雨该吃啥%23,2023-04-20 22:55
室友私生活问题该不该插手,《欢乐颂4》何悯鸿未婚先孕，余初晖终究无法坐视不理通知了何悯鸿的父母，问题来了，室友的私生活该不该插手？,2014829,2478,https://m.weibo.cn/api/container/getIndex?containerid=231522type%3D60%26q%3D%23室友私生活问题该不该插手%23%26t%3D10&title=%E7%83%AD%E9%97%A8-%23室友私生活问题该不该插手%23,https://s.weibo.com/weibo?q=%23室友私生活问题该不该插手%23,2023-04-20 22:55
脂肪肝继续发展会怎么样,脂肪肝早期不痛不痒，但若覆盖肝脏的脂肪越来越多，肝脏炎症持续发作，或致脂肪性肝硬化，进而引发癌变。,3861069,325,https://m.weibo.cn/api/container/getIndex?containerid=231522type%3D60%26q%3D%23脂肪肝继续发展会怎么样%23%26t%3D10&title=%E7%83%AD%E9%97%A8-%23脂肪肝继续发展会怎么样%23,https://s.weibo.com/weibo?q=%23脂肪肝继续发展会怎么样%23,2023-04-20 22:55
汉字为什么叫汉字,我们的文字为什么叫汉字，不叫秦字、唐字或者宋字呢？#汉字不是生来就叫汉字#，是在与其他文明的交流互鉴中应运而生。今天是谷雨，也是联合国中文日，汉字是全世界的瑰宝，更是属于每一位中国人的浪漫！,25182398,1944,https://m.weibo.cn/api/container/getIndex?containerid=231522type%3D60%26q%3D%23汉字为什么叫汉字%23%26t%3D10&title=%E7%83%AD%E9%97%A8-%23汉字为什么叫汉字%23,https://s.weibo.com/weibo?q=%23汉字为什么叫汉字%23,2023-04-20 22:55
为了生孩子而结婚正确吗,为了生孩子而结婚正确吗？你会为了生生孩子而结婚吗,1429848,1823,https://m.weibo.cn/api/container/getIndex?containerid=231522type%3D60%26q%3D%23为了生孩子而结婚正确吗%23%26t%3D10&title=%E7%83%AD%E9%97%A8-%23为了生孩子而结婚正确吗%23,https://s.weibo.com/weibo?q=%23为了生孩子而结婚正确吗%23,2023-04-20 22:55
于文文说今天浅跳了一下还行吗,《声生不息》于文文说今天浅跳了一下还行吗？一起来看美女的节目吧~,442939,496,https://m.weibo.cn/api/container/getIndex?containerid=231522type%3D60%26q%3D%23于文文说今天浅跳了一下还行吗%23%26t%3D10&title=%E7%83%AD%E9%97%A8-%23于文文说今天浅跳了一下还行吗%23,https://s.weibo.com/weibo?q=%23于文文说今天浅跳了一下还行吗%23,2023-04-20 22:55
你的手机扫码丝滑吗,欢迎带话题词分享你的“扫码趣事”,12956255,4161,https://m.weibo.cn/api/container/getIndex?containerid=231522type%3D60%26q%3D%23你的手机扫码丝滑吗%23%26t%3D10&title=%E7%83%AD%E9%97%A8-%23你的手机扫码丝滑吗%23,https://s.weibo.com/weibo?q=%23你的手机扫码丝滑吗%23,2023-04-20 22:55
如何看待狗仔爆料用漫画,如何看待狗仔用画漫画的方式爆料？,993632,2122,https://m.weibo.cn/api/container/getIndex?containerid=231522type%3D60%26q%3D%23如何看待狗仔爆料用漫画%23%26t%3D10&title=%E7%83%AD%E9%97%A8-%23如何看待狗仔爆料用漫画%23,https://s.weibo.com/weibo?q=%23如何看待狗仔爆料用漫画%23,2023-04-20 22:55
女人真的需要男人吗,既然有#男人真的喜欢女人吗#的问题，就应该有#女人真的需要男人吗#。,97201,29,https://m.weibo.cn/api/container/getIndex?containerid=231522type%3D60%26q%3D%23女人真的需要男人吗%23%26t%3D10&title=%E7%83%AD%E9%97%A8-%23女人真的需要男人吗%23,https://s.weibo.com/weibo?q=%23女人真的需要男人吗%23,2023-04-20 22:55
你最想看哪一部五一档电影,《惊天救援》《长空之王》《这么多年》《长沙夜生活》......五一档电影扎堆，你最想看哪部？,256531,90,https://m.weibo.cn/api/container/getIndex?containerid=231522type%3D60%26q%3D%23你最想看哪一部五一档电影%23%26t%3D10&title=%E7%83%AD%E9%97%A8-%23你最想看哪一部五一档电影%23,https://s.weibo.com/weibo?q=%23你最想看哪一部五一档电影%23,2023-04-20 22:55
你最喜欢郑渊洁哪部作品,4月18日，作家郑渊洁发布告别书：每天依然写作 但永远不再发表，21年来只维权成功37个侵权商标，还有673个侵权商标没维权成功，从今天起告别商标维权。,591148,50,https://m.weibo.cn/api/container/getIndex?containerid=231522type%3D60%26q%3D%23你最喜欢郑渊洁哪部作品%23%26t%3D10&title=%E7%83%AD%E9%97%A8-%23你最喜欢郑渊洁哪部作品%23,https://s.weibo.com/weibo?q=%23你最喜欢郑渊洁哪部作品%23,2023-04-20 22:55
印度是苹果的下一个中国吗,知情人士称，库克将于周三前往新德里会见印度总理莫迪。莫迪渴望讨论苹果在印度继续扩张的计划，以及该公司将创造的新就业岗位数量。他还希望听到库克讲述他在试图扩大公司在不同邦的生产时所面临的挑战。,448852,58,https://m.weibo.cn/api/container/getIndex?containerid=231522type%3D60%26q%3D%23印度是苹果的下一个中国吗%23%26t%3D10&title=%E7%83%AD%E9%97%A8-%23印度是苹果的下一个中国吗%23,https://s.weibo.com/weibo?q=%23印度是苹果的下一个中国吗%23,2023-04-20 22:55
为何巴西总统卢拉如此重视此次访华,在中国的4天里，卢拉“很拼”。此番两个发展中大国的合作，看点也相当多。,356460,38,https://m.weibo.cn/api/container/getIndex?containerid=231522type%3D60%26q%3D%23为何巴西总统卢拉如此重视此次访华%23%26t%3D10&title=%E7%83%AD%E9%97%A8-%23为何巴西总统卢拉如此重视此次访华%23,https://s.weibo.com/weibo?q=%23为何巴西总统卢拉如此重视此次访华%23,2023-04-20 22:55
如何避免习惯性抖腿,医生表示，除了通过分散注意力和疏导之外，我们还可以通过主动运动，甚至分块收缩肌肉的方式，例如收缩大腿肌肉、臀部肌肉、脚趾抓住然后放松等动作，形成一定的肌肉记忆，从而自然而然地代替掉抖腿的习惯。,1053046,237,https://m.weibo.cn/api/container/getIndex?containerid=231522type%3D60%26q%3D%23如何避免习惯性抖腿%23%26t%3D10&title=%E7%83%AD%E9%97%A8-%23如何避免习惯性抖腿%23,https://s.weibo.com/weibo?q=%23如何避免习惯性抖腿%23,2023-04-20 22:55
要不要和孩子谈论生命的意义,如何和孩子探讨交流生命的意义？,14548674,7127,https://m.weibo.cn/api/container/getIndex?containerid=231522type%3D60%26q%3D%23要不要和孩子谈论生命的意义%23%26t%3D10&title=%E7%83%AD%E9%97%A8-%23要不要和孩子谈论生命的意义%23,https://s.weibo.com/weibo?q=%23要不要和孩子谈论生命的意义%23,2023-04-20 22:55
你愿意接受延迟退休吗,你愿意接受延迟退休还是灵活退休？这届年轻人已经开始关注退休了！,4007443,1216,https://m.weibo.cn/api/container/getIndex?containerid=231522type%3D60%26q%3D%23你愿意接受延迟退休吗%23%26t%3D10&title=%E7%83%AD%E9%97%A8-%23你愿意接受延迟退休吗%23,https://s.weibo.com/weibo?q=%23你愿意接受延迟退休吗%23,2023-04-20 22:55
肉体上最疼的一次经历是什么,你肉体上最痛的经历是什么？,403077252,25320,https://m.weibo.cn/api/container/getIndex?containerid=231522type%3D60%26q%3D%23肉体上最疼的一次经历是什么%23%26t%3D10&title=%E7%83%AD%E9%97%A8-%23肉体上最疼的一次经历是什么%23,https://s.weibo.com/weibo?q=%23肉体上最疼的一次经历是什么%23,2023-04-20 22:55
找另一半你最看重什么,来聊聊你理想中的另一半吧，一起发微博讨论一下吧！,12806410,2580,https://m.weibo.cn/api/container/getIndex?containerid=231522type%3D60%26q%3D%23找另一半你最看重什么%23%26t%3D10&title=%E7%83%AD%E9%97%A8-%23找另一半你最看重什么%23,https://s.weibo.com/weibo?q=%23找另一半你最看重什么%23,2023-04-20 22:55
找到共同健身的伙伴很重要吗,你喜欢一个人健身还是需要伙伴一起？,4043807,748,https://m.weibo.cn/api/container/getIndex?containerid=231522type%3D60%26q%3D%23找到共同健身的伙伴很重要吗%23%26t%3D10&title=%E7%83%AD%E9%97%A8-%23找到共同健身的伙伴很重要吗%23,https://s.weibo.com/weibo?q=%23找到共同健身的伙伴很重要吗%23,2023-04-20 22:55
你看好特斯拉的全自动驾驶技术吗,特斯拉全自动驾驶技术，你看好吗？,194203,28,https://m.weibo.cn/api/container/getIndex?containerid=231522type%3D60%26q%3D%23你看好特斯拉的全自动驾驶技术吗%23%26t%3D10&title=%E7%83%AD%E9%97%A8-%23你看好特斯拉的全自动驾驶技术吗%23,https://s.weibo.com/weibo?q=%23你看好特斯拉的全自动驾驶技术吗%23,2023-04-20 22:55
乘客开车门造成死伤司机有责任吗,交警提醒使用“两段式开车门”法，开车门时要先打开一个小缝，然后扭头往后观察后方情况，确认安全后再推开车门。,3150981,565,https://m.weibo.cn/api/container/getIndex?containerid=231522type%3D60%26q%3D%23乘客开车门造成死伤司机有责任吗%23%26t%3D10&title=%E7%83%AD%E9%97%A8-%23乘客开车门造成死伤司机有责任吗%23,https://s.weibo.com/weibo?q=%23乘客开车门造成死伤司机有责任吗%23,2023-04-20 22:55
年轻人找对象要趁早吗,4月20日，山东济南，在千佛山相亲会现场，除了现场偶遇，写有详细信息的嘉宾信息牌成为了“红线”，牵起了前来寻缘的单身嘉宾。记者注意到，信息牌上出现了不少“00后“的身影，吸引了现场单身男女的注意。,2342130,101,https://m.weibo.cn/api/container/getIndex?containerid=231522type%3D60%26q%3D%23年轻人找对象要趁早吗%23%26t%3D10&title=%E7%83%AD%E9%97%A8-%23年轻人找对象要趁早吗%23,https://s.weibo.com/weibo?q=%23年轻人找对象要趁早吗%23,2023-04-20 22:55
摆摊卖烤肠真能月入过万吗,“投入小一千，月入快过万？”“卖淀粉肠一个月，我辞掉工作全职摆摊。”……近日，在社交平台上，冲着“遍地黄金”的地摊贴，一批年轻的“掘金人”涌入烤肠界。摆摊卖烤肠真有那么赚？,66279924,2436,https://m.weibo.cn/api/container/getIndex?containerid=231522type%3D60%26q%3D%23摆摊卖烤肠真能月入过万吗%23%26t%3D10&title=%E7%83%AD%E9%97%A8-%23摆摊卖烤肠真能月入过万吗%23,https://s.weibo.com/weibo?q=%23摆摊卖烤肠真能月入过万吗%23,2023-04-20 22:55
祝绪丹你是不是有什么难处,张翰祝绪丹新剧流光引宣传片播出，还是熟悉的味道！,223918051,12275,https://m.weibo.cn/api/container/getIndex?containerid=231522type%3D60%26q%3D%23祝绪丹你是不是有什么难处%23%26t%3D10&title=%E7%83%AD%E9%97%A8-%23祝绪丹你是不是有什么难处%23,https://s.weibo.com/weibo?q=%23祝绪丹你是不是有什么难处%23,2023-04-20 22:55
为什么你到现在都没有恋爱,来评论区说说 你为什么到现在都没有谈恋爱,19125634,6612,https://m.weibo.cn/api/container/getIndex?containerid=231522type%3D60%26q%3D%23为什么你到现在都没有恋爱%23%26t%3D10&title=%E7%83%AD%E9%97%A8-%23为什么你到现在都没有恋爱%23,https://s.weibo.com/weibo?q=%23为什么你到现在都没有恋爱%23,2023-04-20 22:55
未成年人适合玩刺激性娱乐活动吗,11岁女孩小兰与同学相约在玩密室逃脱闯关的过程中，被工作人员扮演的恐怖“怪兽”吓得踩空台阶摔倒。对此，有网友认为密室逃脱这类刺激性娱乐场所不应让未成年进入，也有网友认为这是密室逃脱经营者没做好安全措施与年龄无关，对此你怎么看？,7555792,358,https://m.weibo.cn/api/container/getIndex?containerid=231522type%3D60%26q%3D%23未成年人适合玩刺激性娱乐活动吗%23%26t%3D10&title=%E7%83%AD%E9%97%A8-%23未成年人适合玩刺激性娱乐活动吗%23,https://s.weibo.com/weibo?q=%23未成年人适合玩刺激性娱乐活动吗%23,2023-04-20 22:55
分手后你还会选择复合吗,男女之间的分手，对感情来说可能是一段感情的结束，也可能只是中途插曲。,1465215,2757,https://m.weibo.cn/api/container/getIndex?containerid=231522type%3D60%26q%3D%23分手后你还会选择复合吗%23%26t%3D10&title=%E7%83%AD%E9%97%A8-%23分手后你还会选择复合吗%23,https://s.weibo.com/weibo?q=%23分手后你还会选择复合吗%23,2023-04-20 22:55
纸媒时代结束了吗,近几年，越来越多人将信息获取的渠道转向短视频。你觉得纸媒时代结束了吗？,2333727,131,https://m.weibo.cn/api/container/getIndex?containerid=231522type%3D60%26q%3D%23纸媒时代结束了吗%23%26t%3D10&title=%E7%83%AD%E9%97%A8-%23纸媒时代结束了吗%23,https://s.weibo.com/weibo?q=%23纸媒时代结束了吗%23,2023-04-20 22:55
为什么当代年轻人不愿社交,为什么越来越多人喜欢独处，不愿社交。,3155749,2601,https://m.weibo.cn/api/container/getIndex?containerid=231522type%3D60%26q%3D%23为什么当代年轻人不愿社交%23%26t%3D10&title=%E7%83%AD%E9%97%A8-%23为什么当代年轻人不愿社交%23,https://s.weibo.com/weibo?q=%23为什么当代年轻人不愿社交%23,2023-04-20 22:55
为什么互联网的人35岁就老了,这期《嗨城市猎人》看路泽霖和其他人讨论互联网人过了35岁就很难，看破防了！,8916665,3153,https://m.weibo.cn/api/container/getIndex?containerid=231522type%3D60%26q%3D%23为什么互联网的人35岁就老了%23%26t%3D10&title=%E7%83%AD%E9%97%A8-%23为什么互联网的人35岁就老了%23,https://s.weibo.com/weibo?q=%23为什么互联网的人35岁就老了%23,2023-04-20 22:55
15年前买房有多难,《龙城》陈嫣想买房这段拍得太真实了！15年前买房就已经这么大压力了！,62736084,5979,https://m.weibo.cn/api/container/getIndex?containerid=231522type%3D60%26q%3D%2315年前买房有多难%23%26t%3D10&title=%E7%83%AD%E9%97%A8-%2315年前买房有多难%23,https://s.weibo.com/weibo?q=%2315年前买房有多难%23,2023-04-20 22:55
奢侈品到底贵在哪儿,奢侈品涨价潮此起彼伏，你认为它的“贵”体现在哪？,29103988,14992,https://m.weibo.cn/api/container/getIndex?containerid=231522type%3D60%26q%3D%23奢侈品到底贵在哪儿%23%26t%3D10&title=%E7%83%AD%E9%97%A8-%23奢侈品到底贵在哪儿%23,https://s.weibo.com/weibo?q=%23奢侈品到底贵在哪儿%23,2023-04-20 22:55
如何看待娱乐圈艺人大量接活,对于艺人大量接活的行为，大家怎么看呢，快来分享一下你的观点吧！ ​,68325132,11197,https://m.weibo.cn/api/container/getIndex?containerid=231522type%3D60%26q%3D%23如何看待娱乐圈艺人大量接活%23%26t%3D10&title=%E7%83%AD%E9%97%A8-%23如何看待娱乐圈艺人大量接活%23,https://s.weibo.com/weibo?q=%23如何看待娱乐圈艺人大量接活%23,2023-04-20 22:55
如何看懂军人胸前的荣誉墙,军人勋表共设计4大类39个项目，综合体现官兵功勋荣誉表彰、服役经历、岗位职务层级、服役年限等内容。,2163530,516,https://m.weibo.cn/api/container/getIndex?containerid=231522type%3D60%26q%3D%23如何看懂军人胸前的荣誉墙%23%26t%3D10&title=%E7%83%AD%E9%97%A8-%23如何看懂军人胸前的荣誉墙%23,https://s.weibo.com/weibo?q=%23如何看懂军人胸前的荣誉墙%23,2023-04-20 22:55
为什么说肺癌是慢性疾病,肺癌发展过程要经历4个典型阶段，时间可达5-8年甚至10年，因此肺癌是一种慢性疾病。,11433952,1054,https://m.weibo.cn/api/container/getIndex?containerid=231522type%3D60%26q%3D%23为什么说肺癌是慢性疾病%23%26t%3D10&title=%E7%83%AD%E9%97%A8-%23为什么说肺癌是慢性疾病%23,https://s.weibo.com/weibo?q=%23为什么说肺癌是慢性疾病%23,2023-04-20 22:55
你认真感受今年春天了吗,谷雨的到来意味着，春季即将结束，夏季热情走来。你认真感受今年春天了吗？,6997483,1090,https://m.weibo.cn/api/container/getIndex?containerid=231522type%3D60%26q%3D%23你认真感受今年春天了吗%23%26t%3D10&title=%E7%83%AD%E9%97%A8-%23你认真感受今年春天了吗%23,https://s.weibo.com/weibo?q=%23你认真感受今年春天了吗%23,2023-04-20 22:55
男生身高不到180算矮吗,大家觉得男生身高不到180已经属于矮了吗？,810827,482,https://m.weibo.cn/api/container/getIndex?containerid=231522type%3D60%26q%3D%23男生身高不到180算矮吗%23%26t%3D10&title=%E7%83%AD%E9%97%A8-%23男生身高不到180算矮吗%23,https://s.weibo.com/weibo?q=%23男生身高不到180算矮吗%23,2023-04-20 22:55
结节一定会发展成癌症吗,近些年，不少人在体检中被查出“结节”，便担心有癌变风险。什么是结节？结节一定会发展为癌症吗？如何防治结节？#良性结节变成恶性的概率极低#，结节不可怕，正确预防和治疗是关键。全国肿瘤防治宣传周，听各科专家们的解答↓↓  ​​​,5167629,698,https://m.weibo.cn/api/container/getIndex?containerid=231522type%3D60%26q%3D%23结节一定会发展成癌症吗%23%26t%3D10&title=%E7%83%AD%E9%97%A8-%23结节一定会发展成癌症吗%23,https://s.weibo.com/weibo?q=%23结节一定会发展成癌症吗%23,2023-04-20 22:55
失业找不到工作可以睡哪,送给每一位失业迷茫青年的小知识,2874609,4978,https://m.weibo.cn/api/container/getIndex?containerid=231522type%3D60%26q%3D%23失业找不到工作可以睡哪%23%26t%3D10&title=%E7%83%AD%E9%97%A8-%23失业找不到工作可以睡哪%23,https://s.weibo.com/weibo?q=%23失业找不到工作可以睡哪%23,2023-04-20 22:55
为什么年轻人钟爱搭子式社交,近日，“搭子是一种新型社交关系”的话题引发网友讨论 。不少年轻人都有自己的“饭搭子”、“游戏搭子”、“健身搭子”等“搭子”社交关系。,1728818,74,https://m.weibo.cn/api/container/getIndex?containerid=231522type%3D60%26q%3D%23为什么年轻人钟爱搭子式社交%23%26t%3D10&title=%E7%83%AD%E9%97%A8-%23为什么年轻人钟爱搭子式社交%23,https://s.weibo.com/weibo?q=%23为什么年轻人钟爱搭子式社交%23,2023-04-20 22:55
一个人老了的标志是什么,因为年龄的关系，所以是线性的。新事情记不住，旧事情忘不了，心理方面就是一个字‘淡‘什么都淡了。虽然人在社会里，该看透的也看透了，能无视的也无视了。,17885099,5505,https://m.weibo.cn/api/container/getIndex?containerid=231522type%3D60%26q%3D%23一个人老了的标志是什么%23%26t%3D10&title=%E7%83%AD%E9%97%A8-%23一个人老了的标志是什么%23,https://s.weibo.com/weibo?q=%23一个人老了的标志是什么%23,2023-04-20 22:55
你羡慕爸妈的爱情吗,樊霄堂张霄帅在《抖包袱大会》演绎两代人在不同领域的观念差异，但不管怎么变，爱的内核都是相同的。,1043894,52,https://m.weibo.cn/api/container/getIndex?containerid=231522type%3D60%26q%3D%23你羡慕爸妈的爱情吗%23%26t%3D10&title=%E7%83%AD%E9%97%A8-%23你羡慕爸妈的爱情吗%23,https://s.weibo.com/weibo?q=%23你羡慕爸妈的爱情吗%23,2023-04-20 22:55
不生孩子还用努力工作吗,我们工作那么拼，是为了什么呢？,9959031,2136,https://m.weibo.cn/api/container/getIndex?containerid=231522type%3D60%26q%3D%23不生孩子还用努力工作吗%23%26t%3D10&title=%E7%83%AD%E9%97%A8-%23不生孩子还用努力工作吗%23,https://s.weibo.com/weibo?q=%23不生孩子还用努力工作吗%23,2023-04-20 22:55
长得漂亮就一定会被喜欢吗,一定要长得漂亮才会被爱吗,7877090,3160,https://m.weibo.cn/api/container/getIndex?containerid=231522type%3D60%26q%3D%23长得漂亮就一定会被喜欢吗%23%26t%3D10&title=%E7%83%AD%E9%97%A8-%23长得漂亮就一定会被喜欢吗%23,https://s.weibo.com/weibo?q=%23长得漂亮就一定会被喜欢吗%23,2023-04-20 22:55
00后都有哪些焦虑,在如此内卷的时代，00后都有哪些焦虑？,11728797,4676,https://m.weibo.cn/api/container/getIndex?containerid=231522type%3D60%26q%3D%2300后都有哪些焦虑%23%26t%3D10&title=%E7%83%AD%E9%97%A8-%2300后都有哪些焦虑%23,https://s.weibo.com/weibo?q=%2300后都有哪些焦虑%23,2023-04-20 22:55
该为了爱情放弃工作吗,你们会为了爱情放弃自己的工作吗？,1186963,4626,https://m.weibo.cn/api/container/getIndex?containerid=231522type%3D60%26q%3D%23该为了爱情放弃工作吗%23%26t%3D10&title=%E7%83%AD%E9%97%A8-%23该为了爱情放弃工作吗%23,https://s.weibo.com/weibo?q=%23该为了爱情放弃工作吗%23,2023-04-20 22:55
扬州炒饭的灵魂到底是什么,去扬州，一定要尝尝正宗的扬州炒饭！举世闻名的扬州炒饭有十几种配料！火腿、鸡蛋、葱花、虾仁、豌豆、胡萝卜……你心中扬州炒饭的灵魂是什么呢？,3896052,366,https://m.weibo.cn/api/container/getIndex?containerid=231522type%3D60%26q%3D%23扬州炒饭的灵魂到底是什么%23%26t%3D10&title=%E7%83%AD%E9%97%A8-%23扬州炒饭的灵魂到底是什么%23,https://s.weibo.com/weibo?q=%23扬州炒饭的灵魂到底是什么%23,2023-04-20 22:55
长峰医院是如何搭建三甲医院朋友圈的,长峰医院集团起家于2003年汪文杰在湖北鄂州开创的第一家血管瘤专科医院，20年来逐步在北京、上海、郑州等全国布局近20家医院。从一家普通的地市级专科医院发展成谋求北交所IPO的医疗集团，汪文杰又是如何打造长峰医院的？,103081266,1439,https://m.weibo.cn/api/container/getIndex?containerid=231522type%3D60%26q%3D%23长峰医院是如何搭建三甲医院朋友圈的%23%26t%3D10&title=%E7%83%AD%E9%97%A8-%23长峰医院是如何搭建三甲医院朋友圈的%23,https://s.weibo.com/weibo?q=%23长峰医院是如何搭建三甲医院朋友圈的%23,2023-04-20 22:55
你会因为工作影响心情吗,你会因为工作影响一整天的心情吗？,3320632,1047,https://m.weibo.cn/api/container/getIndex?containerid=231522type%3D60%26q%3D%23你会因为工作影响心情吗%23%26t%3D10&title=%E7%83%AD%E9%97%A8-%23你会因为工作影响心情吗%23,https://s.weibo.com/weibo?q=%23你会因为工作影响心情吗%23,2023-04-20 22:55
本届香港金像奖遗珠是哪部,大家来说说本届香港金像奖有哪些遗珠,302717,1310,https://m.weibo.cn/api/container/getIndex?containerid=231522type%3D60%26q%3D%23本届香港金像奖遗珠是哪部%23%26t%3D10&title=%E7%83%AD%E9%97%A8-%23本届香港金像奖遗珠是哪部%23,https://s.weibo.com/weibo?q=%23本届香港金像奖遗珠是哪部%23,2023-04-20 22:55
你的梦中情伞是怎么样的,晒出你心中的梦中情伞吧,4693885,2226,https://m.weibo.cn/api/container/getIndex?containerid=231522type%3D60%26q%3D%23你的梦中情伞是怎么样的%23%26t%3D10&title=%E7%83%AD%E9%97%A8-%23你的梦中情伞是怎么样的%23,https://s.weibo.com/weibo?q=%23你的梦中情伞是怎么样的%23,2023-04-20 22:55
