word,summary,read,mention,href,link,time_stamp
冲泡杯装奶茶还有人买吗,自2020年起，香飘飘的营业收入陷入三连挫境地。连年来的负增长营收，最能反映其近年来不受市场欢迎的现状。尽管近年来香飘飘为了迎合消费者，进行过许多尝试，但香飘飘营收连年下滑的趋势却并未减弱。,320216,25,https://m.weibo.cn/api/container/getIndex?containerid=231522type%3D60%26q%3D%23冲泡杯装奶茶还有人买吗%23%26t%3D10&title=%E7%83%AD%E9%97%A8-%23冲泡杯装奶茶还有人买吗%23,https://s.weibo.com/weibo?q=%23冲泡杯装奶茶还有人买吗%23,2023-04-20 22:55
年轻人为什么不爱香飘飘了,在消费者，特别是年轻消费者心目中，香飘飘类“冲泡杯装奶茶”的存在感，并不高。而香飘飘近年来负增长的营收，最能反映其近年来不受市场欢迎的现状。,336592,22,https://m.weibo.cn/api/container/getIndex?containerid=231522type%3D60%26q%3D%23年轻人为什么不爱香飘飘了%23%26t%3D10&title=%E7%83%AD%E9%97%A8-%23年轻人为什么不爱香飘飘了%23,https://s.weibo.com/weibo?q=%23年轻人为什么不爱香飘飘了%23,2023-04-20 22:55
你有过应聘时因身高被拒的经历吗,日前，女孩应聘商务专员因身高177cm被拒一事冲上热搜，引发网友热议。那么，你在找工作应聘时，有遇到过因为身高问题被拒绝的情况吗？,1344866,123,https://m.weibo.cn/api/container/getIndex?containerid=231522type%3D60%26q%3D%23你有过应聘时因身高被拒的经历吗%23%26t%3D10&title=%E7%83%AD%E9%97%A8-%23你有过应聘时因身高被拒的经历吗%23,https://s.weibo.com/weibo?q=%23你有过应聘时因身高被拒的经历吗%23,2023-04-20 22:55
土木专业前景还好吗,近段时间，多所高校的土木工程学院相继召开专题会议，推进毕业生就业工作。,293790,15,https://m.weibo.cn/api/container/getIndex?containerid=231522type%3D60%26q%3D%23土木专业前景还好吗%23%26t%3D10&title=%E7%83%AD%E9%97%A8-%23土木专业前景还好吗%23,https://s.weibo.com/weibo?q=%23土木专业前景还好吗%23,2023-04-20 22:55
你会为了餐补推迟下班吗,是你的话，你会等到7点半吗？,2663739,2541,https://m.weibo.cn/api/container/getIndex?containerid=231522type%3D60%26q%3D%23你会为了餐补推迟下班吗%23%26t%3D10&title=%E7%83%AD%E9%97%A8-%23你会为了餐补推迟下班吗%23,https://s.weibo.com/weibo?q=%23你会为了餐补推迟下班吗%23,2023-04-20 22:55
你会吃玻尿酸食品吗,有“医美万金油”之称的玻尿酸忽然成为食品行业新宠。不过，价格动辄是普通食品数倍的玻尿酸食品真的有奇效吗？热潮之下，乱象丛生，对玻尿酸食品跃跃欲试的消费者，到底为什么会“踩坑”？,461948,58,https://m.weibo.cn/api/container/getIndex?containerid=231522type%3D60%26q%3D%23你会吃玻尿酸食品吗%23%26t%3D10&title=%E7%83%AD%E9%97%A8-%23你会吃玻尿酸食品吗%23,https://s.weibo.com/weibo?q=%23你会吃玻尿酸食品吗%23,2023-04-20 22:55
距离会是爱情的绊脚石吗,你觉得距离会是爱情的绊脚石吗？来看看杭州街头的小伙伴怎么说？,2625233,2170,https://m.weibo.cn/api/container/getIndex?containerid=231522type%3D60%26q%3D%23距离会是爱情的绊脚石吗%23%26t%3D10&title=%E7%83%AD%E9%97%A8-%23距离会是爱情的绊脚石吗%23,https://s.weibo.com/weibo?q=%23距离会是爱情的绊脚石吗%23,2023-04-20 22:55
成都大运会熊猫图标动起来什么样,击剑、打篮球、摔跤、体操……#动起来的熊猫图标仿佛武林高手#。网友：全都是花花的分身吧！100天后，成都见！,9283010,3353,https://m.weibo.cn/api/container/getIndex?containerid=231522type%3D60%26q%3D%23成都大运会熊猫图标动起来什么样%23%26t%3D10&title=%E7%83%AD%E9%97%A8-%23成都大运会熊猫图标动起来什么样%23,https://s.weibo.com/weibo?q=%23成都大运会熊猫图标动起来什么样%23,2023-04-20 22:55
离职前还会认真工作吗,要离职之前你的工作态度是怎样的？,27890897,2781,https://m.weibo.cn/api/container/getIndex?containerid=231522type%3D60%26q%3D%23离职前还会认真工作吗%23%26t%3D10&title=%E7%83%AD%E9%97%A8-%23离职前还会认真工作吗%23,https://s.weibo.com/weibo?q=%23离职前还会认真工作吗%23,2023-04-20 22:55
这是公交主题餐厅吗,这顿饭吃出了团结一致，众志成城的感觉,548897,1350,https://m.weibo.cn/api/container/getIndex?containerid=231522type%3D60%26q%3D%23这是公交主题餐厅吗%23%26t%3D10&title=%E7%83%AD%E9%97%A8-%23这是公交主题餐厅吗%23,https://s.weibo.com/weibo?q=%23这是公交主题餐厅吗%23,2023-04-20 22:55
如何选择自己想看的书,书海浩瀚，你是怎么决定自己将要看哪本书的呢？快来参与投票，告诉我们你的选书小窍门吧~,831717,161,https://m.weibo.cn/api/container/getIndex?containerid=231522type%3D60%26q%3D%23如何选择自己想看的书%23%26t%3D10&title=%E7%83%AD%E9%97%A8-%23如何选择自己想看的书%23,https://s.weibo.com/weibo?q=%23如何选择自己想看的书%23,2023-04-20 22:55
怎样让知识与运动共舞,球服为校服、班班建立6支球队、年年举办班级球类联赛……球类运动成为这所学校育人最有力的载体，孩子们在训练与对抗中习得技能、强身健体、磨炼意志，“读书不忘运动，运动不忘读书”的育人理念真正得到践行。,118835,13,https://m.weibo.cn/api/container/getIndex?containerid=231522type%3D60%26q%3D%23怎样让知识与运动共舞%23%26t%3D10&title=%E7%83%AD%E9%97%A8-%23怎样让知识与运动共舞%23,https://s.weibo.com/weibo?q=%23怎样让知识与运动共舞%23,2023-04-20 22:55
婆媳矛盾真的不可调和吗,《欢乐颂4》热播，连清醒理智的叶蓁蓁都忍无可忍拉黑戴维妈妈，婆媳矛盾真的就无法避免、不可调和吗？,5401779,5177,https://m.weibo.cn/api/container/getIndex?containerid=231522type%3D60%26q%3D%23婆媳矛盾真的不可调和吗%23%26t%3D10&title=%E7%83%AD%E9%97%A8-%23婆媳矛盾真的不可调和吗%23,https://s.weibo.com/weibo?q=%23婆媳矛盾真的不可调和吗%23,2023-04-20 22:55
为什么学生时代都有拔河,谁的青春没有拔过河？拔河作为一项团体运动，考验的凝聚力和团队精神，拔河拔的不仅是力气，是青春与热血。,4710629,7180,https://m.weibo.cn/api/container/getIndex?containerid=231522type%3D60%26q%3D%23为什么学生时代都有拔河%23%26t%3D10&title=%E7%83%AD%E9%97%A8-%23为什么学生时代都有拔河%23,https://s.weibo.com/weibo?q=%23为什么学生时代都有拔河%23,2023-04-20 22:55
人类的逆反心理有多强,人类的逆反心理有多强全身上下全是反骨,5177601,2246,https://m.weibo.cn/api/container/getIndex?containerid=231522type%3D60%26q%3D%23人类的逆反心理有多强%23%26t%3D10&title=%E7%83%AD%E9%97%A8-%23人类的逆反心理有多强%23,https://s.weibo.com/weibo?q=%23人类的逆反心理有多强%23,2023-04-20 22:55
给老百姓发消费券提升经济你支持吗,清华大学教授李稻葵提出一项建议，即向全国发放5000亿消费券，以刺激经济，提高百姓消费水平。,776477,36,https://m.weibo.cn/api/container/getIndex?containerid=231522type%3D60%26q%3D%23给老百姓发消费券提升经济你支持吗%23%26t%3D10&title=%E7%83%AD%E9%97%A8-%23给老百姓发消费券提升经济你支持吗%23,https://s.weibo.com/weibo?q=%23给老百姓发消费券提升经济你支持吗%23,2023-04-20 22:55
一个人去西藏是种什么体验,一个人去西藏是种什么体验？,3556854,1877,https://m.weibo.cn/api/container/getIndex?containerid=231522type%3D60%26q%3D%23一个人去西藏是种什么体验%23%26t%3D10&title=%E7%83%AD%E9%97%A8-%23一个人去西藏是种什么体验%23,https://s.weibo.com/weibo?q=%23一个人去西藏是种什么体验%23,2023-04-20 22:55
这样的幸福是真实存在的吗,羡慕两个字我已经说累了,2144636,1011,https://m.weibo.cn/api/container/getIndex?containerid=231522type%3D60%26q%3D%23这样的幸福是真实存在的吗%23%26t%3D10&title=%E7%83%AD%E9%97%A8-%23这样的幸福是真实存在的吗%23,https://s.weibo.com/weibo?q=%23这样的幸福是真实存在的吗%23,2023-04-20 22:55
你最想要哪种搭子,数据显示，超一半的年轻人有搭子。你最想要哪种搭子？,3368029,75,https://m.weibo.cn/api/container/getIndex?containerid=231522type%3D60%26q%3D%23你最想要哪种搭子%23%26t%3D10&title=%E7%83%AD%E9%97%A8-%23你最想要哪种搭子%23,https://s.weibo.com/weibo?q=%23你最想要哪种搭子%23,2023-04-20 22:55
观众为何热衷审判仙侠剧,#观众为何热衷审判仙侠剧##观众期待侠能够回归仙侠剧#,1922203,187,https://m.weibo.cn/api/container/getIndex?containerid=231522type%3D60%26q%3D%23观众为何热衷审判仙侠剧%23%26t%3D10&title=%E7%83%AD%E9%97%A8-%23观众为何热衷审判仙侠剧%23,https://s.weibo.com/weibo?q=%23观众为何热衷审判仙侠剧%23,2023-04-20 22:55
你是怎样看待远嫁的,你会不会选择远离家乡远离父母去追寻自己的真爱？,6646476,1873,https://m.weibo.cn/api/container/getIndex?containerid=231522type%3D60%26q%3D%23你是怎样看待远嫁的%23%26t%3D10&title=%E7%83%AD%E9%97%A8-%23你是怎样看待远嫁的%23,https://s.weibo.com/weibo?q=%23你是怎样看待远嫁的%23,2023-04-20 22:55
为什么年轻人干啥都喜欢找搭子,搭子作为一种新型的社交关系，主打垂直领域细分陪伴，一起吃饭、一起运动、一起摸鱼。,524073,27,https://m.weibo.cn/api/container/getIndex?containerid=231522type%3D60%26q%3D%23为什么年轻人干啥都喜欢找搭子%23%26t%3D10&title=%E7%83%AD%E9%97%A8-%23为什么年轻人干啥都喜欢找搭子%23,https://s.weibo.com/weibo?q=%23为什么年轻人干啥都喜欢找搭子%23,2023-04-20 22:55
你的2022年度网剧是哪部,#北京春推会年度网络剧#提到了《猎罪图鉴》《罚罪》《重生之门》《显微镜下的大明之丝绢案》《苍兰诀》《开端》《唐朝诡事录》《卿卿日常》 …哪一部是你的最爱？,239698,38,https://m.weibo.cn/api/container/getIndex?containerid=231522type%3D60%26q%3D%23你的2022年度网剧是哪部%23%26t%3D10&title=%E7%83%AD%E9%97%A8-%23你的2022年度网剧是哪部%23,https://s.weibo.com/weibo?q=%23你的2022年度网剧是哪部%23,2023-04-20 22:55
你会给文件夹起什么名字,你们电脑的文件夹都叫啥名字？,1665658,2273,https://m.weibo.cn/api/container/getIndex?containerid=231522type%3D60%26q%3D%23你会给文件夹起什么名字%23%26t%3D10&title=%E7%83%AD%E9%97%A8-%23你会给文件夹起什么名字%23,https://s.weibo.com/weibo?q=%23你会给文件夹起什么名字%23,2023-04-20 22:55
你每天刷短视频的时间有多长,中国青年报社社会调查中心对1538名受访者进行的一项调查显示，45.6%的受访者表示每天花在刷短视频上的时间在2小时以上，87.6%的受访者表示在假期刷短视频会比平时多。,4776578,77,https://m.weibo.cn/api/container/getIndex?containerid=231522type%3D60%26q%3D%23你每天刷短视频的时间有多长%23%26t%3D10&title=%E7%83%AD%E9%97%A8-%23你每天刷短视频的时间有多长%23,https://s.weibo.com/weibo?q=%23你每天刷短视频的时间有多长%23,2023-04-20 22:55
到底怎样才能释怀一段关系,怎么样才能真正释怀一段关系呢？一起聊聊吧。,3262756,4900,https://m.weibo.cn/api/container/getIndex?containerid=231522type%3D60%26q%3D%23到底怎样才能释怀一段关系%23%26t%3D10&title=%E7%83%AD%E9%97%A8-%23到底怎样才能释怀一段关系%23,https://s.weibo.com/weibo?q=%23到底怎样才能释怀一段关系%23,2023-04-20 22:55
医院如何做好防火安全,4月18日，北京长峰医院住院部东楼发生火情。截至18时，经转院救治无效，21人不幸死亡。,26061134,993,https://m.weibo.cn/api/container/getIndex?containerid=231522type%3D60%26q%3D%23医院如何做好防火安全%23%26t%3D10&title=%E7%83%AD%E9%97%A8-%23医院如何做好防火安全%23,https://s.weibo.com/weibo?q=%23医院如何做好防火安全%23,2023-04-20 22:55
下一个宝藏城市会在哪条赛道起飞,这两天，继山东淄博烧烤之后，山东潍坊的风筝也火了。下一个宝藏城市会在哪条赛道起飞？,7054488,865,https://m.weibo.cn/api/container/getIndex?containerid=231522type%3D60%26q%3D%23下一个宝藏城市会在哪条赛道起飞%23%26t%3D10&title=%E7%83%AD%E9%97%A8-%23下一个宝藏城市会在哪条赛道起飞%23,https://s.weibo.com/weibo?q=%23下一个宝藏城市会在哪条赛道起飞%23,2023-04-20 22:55
存钱的意义到底是什么,我们努力存钱的意义到底是什么？你会选择存钱还是及时行乐呢？,15317014,723,https://m.weibo.cn/api/container/getIndex?containerid=231522type%3D60%26q%3D%23存钱的意义到底是什么%23%26t%3D10&title=%E7%83%AD%E9%97%A8-%23存钱的意义到底是什么%23,https://s.weibo.com/weibo?q=%23存钱的意义到底是什么%23,2023-04-20 22:55
毕业到现在存了多少钱,毕业到现在存了多少钱了呢,4891961,1209,https://m.weibo.cn/api/container/getIndex?containerid=231522type%3D60%26q%3D%23毕业到现在存了多少钱%23%26t%3D10&title=%E7%83%AD%E9%97%A8-%23毕业到现在存了多少钱%23,https://s.weibo.com/weibo?q=%23毕业到现在存了多少钱%23,2023-04-20 22:55
对男爱豆的身高应该有要求吗,对男爱豆的身高应该有要求吗？,18948251,2377,https://m.weibo.cn/api/container/getIndex?containerid=231522type%3D60%26q%3D%23对男爱豆的身高应该有要求吗%23%26t%3D10&title=%E7%83%AD%E9%97%A8-%23对男爱豆的身高应该有要求吗%23,https://s.weibo.com/weibo?q=%23对男爱豆的身高应该有要求吗%23,2023-04-20 22:55
你为什么爱过度思考,你为什么爱过度思考？,4739025,4191,https://m.weibo.cn/api/container/getIndex?containerid=231522type%3D60%26q%3D%23你为什么爱过度思考%23%26t%3D10&title=%E7%83%AD%E9%97%A8-%23你为什么爱过度思考%23,https://s.weibo.com/weibo?q=%23你为什么爱过度思考%23,2023-04-20 22:55
怎么会有猫这样睡觉啊,怎么会有猫这样睡觉啊～ 这睡姿放到整个猫届也是相当炸裂的！,2169870,1427,https://m.weibo.cn/api/container/getIndex?containerid=231522type%3D60%26q%3D%23怎么会有猫这样睡觉啊%23%26t%3D10&title=%E7%83%AD%E9%97%A8-%23怎么会有猫这样睡觉啊%23,https://s.weibo.com/weibo?q=%23怎么会有猫这样睡觉啊%23,2023-04-20 22:55
这真的不是亲子鉴定吗,你论文查重通过了吗？,4762655,4083,https://m.weibo.cn/api/container/getIndex?containerid=231522type%3D60%26q%3D%23这真的不是亲子鉴定吗%23%26t%3D10&title=%E7%83%AD%E9%97%A8-%23这真的不是亲子鉴定吗%23,https://s.weibo.com/weibo?q=%23这真的不是亲子鉴定吗%23,2023-04-20 22:55
淄博烧烤的热度为什么居高不下,从3月初大学生“特种兵”们攻占淄博烧烤，到如今火爆全网，一个多月以来，有关淄博的热搜，一波接一波霸屏，完全没有停歇的意思。据了解，“五一”期间淄博旅游订单同比增长2000%。有网友好奇，淄博烧烤的热度为什么居高不下？,3942182,279,https://m.weibo.cn/api/container/getIndex?containerid=231522type%3D60%26q%3D%23淄博烧烤的热度为什么居高不下%23%26t%3D10&title=%E7%83%AD%E9%97%A8-%23淄博烧烤的热度为什么居高不下%23,https://s.weibo.com/weibo?q=%23淄博烧烤的热度为什么居高不下%23,2023-04-20 22:55
遇到蒋梦婕的遭遇你会怎么办,遇到蒋梦婕的遭遇你会怎么办？我觉得可能会和蒋梦婕一样吧，遇到蒋梦婕的遭遇你怎么处理？,871170,527,https://m.weibo.cn/api/container/getIndex?containerid=231522type%3D60%26q%3D%23遇到蒋梦婕的遭遇你会怎么办%23%26t%3D10&title=%E7%83%AD%E9%97%A8-%23遇到蒋梦婕的遭遇你会怎么办%23,https://s.weibo.com/weibo?q=%23遇到蒋梦婕的遭遇你会怎么办%23,2023-04-20 22:55
为什么很多情侣败给了冷淡期,你觉得为什么很多情侣都败给了冷淡期？,6814450,1371,https://m.weibo.cn/api/container/getIndex?containerid=231522type%3D60%26q%3D%23为什么很多情侣败给了冷淡期%23%26t%3D10&title=%E7%83%AD%E9%97%A8-%23为什么很多情侣败给了冷淡期%23,https://s.weibo.com/weibo?q=%23为什么很多情侣败给了冷淡期%23,2023-04-20 22:55
郑云龙问准备好纸巾了吗,郑云龙晒14号球服，问准备好纸巾了吗？？,2367544,1258,https://m.weibo.cn/api/container/getIndex?containerid=231522type%3D60%26q%3D%23郑云龙问准备好纸巾了吗%23%26t%3D10&title=%E7%83%AD%E9%97%A8-%23郑云龙问准备好纸巾了吗%23,https://s.weibo.com/weibo?q=%23郑云龙问准备好纸巾了吗%23,2023-04-20 22:55
20岁回乡当村医是什么体验,小杨工作时有些“画风清奇”，她常常会在田间地头连连“嘶吼”——下队随访时遇到听力不好、难以沟通的老人，必须扯着嗓子问诊。,34800823,12457,https://m.weibo.cn/api/container/getIndex?containerid=231522type%3D60%26q%3D%2320岁回乡当村医是什么体验%23%26t%3D10&title=%E7%83%AD%E9%97%A8-%2320岁回乡当村医是什么体验%23,https://s.weibo.com/weibo?q=%2320岁回乡当村医是什么体验%23,2023-04-20 22:55
夜间醒来看时间会影响睡眠吗,睡眠过程中突然醒来，很多人的第一反应都是拿起表或手机，看看现在几点了。医生表示：对于睡眠质量很好的人来说，入睡或觉醒其实不用参考时间，而睡眠不好的人夜间睡眠过程当中最好不要看时间，这种行为对于睡眠没有任何积极的影响，反而会影响睡眠。,700347,134,https://m.weibo.cn/api/container/getIndex?containerid=231522type%3D60%26q%3D%23夜间醒来看时间会影响睡眠吗%23%26t%3D10&title=%E7%83%AD%E9%97%A8-%23夜间醒来看时间会影响睡眠吗%23,https://s.weibo.com/weibo?q=%23夜间醒来看时间会影响睡眠吗%23,2023-04-20 22:55
你有七年以上的友谊吗,你有七年以上的友谊吗？,921656,2996,https://m.weibo.cn/api/container/getIndex?containerid=231522type%3D60%26q%3D%23你有七年以上的友谊吗%23%26t%3D10&title=%E7%83%AD%E9%97%A8-%23你有七年以上的友谊吗%23,https://s.weibo.com/weibo?q=%23你有七年以上的友谊吗%23,2023-04-20 22:55
你认为读书需要仪式感吗,有人觉得读书需要仪式感，最好是有一张安静的书桌，不受干扰的翻阅纸质书籍；也有人觉得读书不必拘泥形式，哪怕是排队时拿手机阅读也算在读书。你认为读书需要仪式感吗？,9210473,312,https://m.weibo.cn/api/container/getIndex?containerid=231522type%3D60%26q%3D%23你认为读书需要仪式感吗%23%26t%3D10&title=%E7%83%AD%E9%97%A8-%23你认为读书需要仪式感吗%23,https://s.weibo.com/weibo?q=%23你认为读书需要仪式感吗%23,2023-04-20 22:55
水乳真的能美白吗,春夏护肤既要清爽又要有功效，该如何选择护肤品？「美丽行动」连线“老爸抽检”团队，带你探究水乳真的能美白吗？,5988009,1819,https://m.weibo.cn/api/container/getIndex?containerid=231522type%3D60%26q%3D%23水乳真的能美白吗%23%26t%3D10&title=%E7%83%AD%E9%97%A8-%23水乳真的能美白吗%23,https://s.weibo.com/weibo?q=%23水乳真的能美白吗%23,2023-04-20 22:55
