word,summary,read,mention,href,link,time_stamp
大主播为何纷纷买楼盖楼,2021年12月，薇娅因偷逃税被罚13.41亿元离开了“一线”，但旗下直播带货业务并未停滞，此番更是斥资2200万拿地。,2756919,442,https://m.weibo.cn/api/container/getIndex?containerid=231522type%3D60%26q%3D%23大主播为何纷纷买楼盖楼%23%26t%3D10&title=%E7%83%AD%E9%97%A8-%23大主播为何纷纷买楼盖楼%23,https://s.weibo.com/weibo?q=%23大主播为何纷纷买楼盖楼%23,2023-04-18 12:57
小时候撒谎这么明显吗,小时候撒谎这么明显吗？,12266153,4357,https://m.weibo.cn/api/container/getIndex?containerid=231522type%3D60%26q%3D%23小时候撒谎这么明显吗%23%26t%3D10&title=%E7%83%AD%E9%97%A8-%23小时候撒谎这么明显吗%23,https://s.weibo.com/weibo?q=%23小时候撒谎这么明显吗%23,2023-04-18 12:57
遇到商家强迫交易怎么维权,遇到商家强买强卖、强迫交易时该怎么办？依据我国相关法律的规定，进行买卖交易的时候，双方要在平等、自愿的基础上进行，不得进行强买强卖，强迫交易行为是不受法律保护的。戳↓,1236105,279,https://m.weibo.cn/api/container/getIndex?containerid=231522type%3D60%26q%3D%23遇到商家强迫交易怎么维权%23%26t%3D10&title=%E7%83%AD%E9%97%A8-%23遇到商家强迫交易怎么维权%23,https://s.weibo.com/weibo?q=%23遇到商家强迫交易怎么维权%23,2023-04-18 12:57
2025年为何是智能电动汽车分水岭,4 月 16 日，理想汽车 CEO 李想表示，智能电动车的三年淘汰赛已经开始，将从 2023 年一直持续到 2025 年。余承东表示，我们走向智能电动网联汽车时代，2025 年会有分水岭，有可能形成大的逆转，相当于手机行业 2013 年的大逆转。,1131495,299,https://m.weibo.cn/api/container/getIndex?containerid=231522type%3D60%26q%3D%232025年为何是智能电动汽车分水岭%23%26t%3D10&title=%E7%83%AD%E9%97%A8-%232025年为何是智能电动汽车分水岭%23,https://s.weibo.com/weibo?q=%232025年为何是智能电动汽车分水岭%23,2023-04-18 12:57
这个假是非调不可吗,五一假期你会怎么安排自己的生活呢？,5636215,1321,https://m.weibo.cn/api/container/getIndex?containerid=231522type%3D60%26q%3D%23这个假是非调不可吗%23%26t%3D10&title=%E7%83%AD%E9%97%A8-%23这个假是非调不可吗%23,https://s.weibo.com/weibo?q=%23这个假是非调不可吗%23,2023-04-18 12:57
王鹤棣在向篮筐求婚吗,王鹤棣在向篮筐求婚吗,3873974,534,https://m.weibo.cn/api/container/getIndex?containerid=231522type%3D60%26q%3D%23王鹤棣在向篮筐求婚吗%23%26t%3D10&title=%E7%83%AD%E9%97%A8-%23王鹤棣在向篮筐求婚吗%23,https://s.weibo.com/weibo?q=%23王鹤棣在向篮筐求婚吗%23,2023-04-18 12:57
节假日加班后调休还要给加班费吗,五一劳动节假期即将来临，你有安排了吗？今年“五一”劳动节放假时间为：2023年4月29日（星期六）至5月3日（星期三）放假调休，共5天。4月23日（星期日）、5月6日（星期六）上班。也就是本周要上6天班。然而，“五一”假期期间还有很多人需要坚守岗位，那么，法定节假日加班后被安排补休，公司还用支付加班费吗？戳视频，一起了解↓,669902,362,https://m.weibo.cn/api/container/getIndex?containerid=231522type%3D60%26q%3D%23节假日加班后调休还要给加班费吗%23%26t%3D10&title=%E7%83%AD%E9%97%A8-%23节假日加班后调休还要给加班费吗%23,https://s.weibo.com/weibo?q=%23节假日加班后调休还要给加班费吗%23,2023-04-18 12:57
马斯克的星舰能否成功发射,大家觉得马斯克旗下SpaceX公司大型深空火箭星舰今晚能成功发射升空吗？  ​​​,25776390,1887,https://m.weibo.cn/api/container/getIndex?containerid=231522type%3D60%26q%3D%23马斯克的星舰能否成功发射%23%26t%3D10&title=%E7%83%AD%E9%97%A8-%23马斯克的星舰能否成功发射%23,https://s.weibo.com/weibo?q=%23马斯克的星舰能否成功发射%23,2023-04-18 12:57
叶夕雾攻略进度会不会提前,《长月烬明》叶夕雾攻略进度会不会提前,795615,318,https://m.weibo.cn/api/container/getIndex?containerid=231522type%3D60%26q%3D%23叶夕雾攻略进度会不会提前%23%26t%3D10&title=%E7%83%AD%E9%97%A8-%23叶夕雾攻略进度会不会提前%23,https://s.weibo.com/weibo?q=%23叶夕雾攻略进度会不会提前%23,2023-04-18 12:57
沙尘天气如何护肤,沙尘来袭，怎么科学防护，正确护肤？,1160646,108,https://m.weibo.cn/api/container/getIndex?containerid=231522type%3D60%26q%3D%23沙尘天气如何护肤%23%26t%3D10&title=%E7%83%AD%E9%97%A8-%23沙尘天气如何护肤%23,https://s.weibo.com/weibo?q=%23沙尘天气如何护肤%23,2023-04-18 12:57
法定假日加班可用调休代替工资吗,“五一”小长假即将来临，不少单位会根据工作需要，安排员工加班。那么，职工法定节假日加班后，公司以调休而拒绝支付3倍的加班工资合法吗？是否有法律依据？,222121,310,https://m.weibo.cn/api/container/getIndex?containerid=231522type%3D60%26q%3D%23法定假日加班可用调休代替工资吗%23%26t%3D10&title=%E7%83%AD%E9%97%A8-%23法定假日加班可用调休代替工资吗%23,https://s.weibo.com/weibo?q=%23法定假日加班可用调休代替工资吗%23,2023-04-18 12:57
李诞新节目喜剧大会怎么样,前不久，#今天听月亮# 有幸作为第一波嘉宾受邀观看了节目首次录制。两天的时间，我们一口气看完了50多位喜剧演员的20多个喜剧作品，趁着感受还强烈，本期就和大家聊一聊《喜剧大会》的观后感...,690171,55,https://m.weibo.cn/api/container/getIndex?containerid=231522type%3D60%26q%3D%23李诞新节目喜剧大会怎么样%23%26t%3D10&title=%E7%83%AD%E9%97%A8-%23李诞新节目喜剧大会怎么样%23,https://s.weibo.com/weibo?q=%23李诞新节目喜剧大会怎么样%23,2023-04-18 12:57
觉得饭不好吃告诉老板丢人吗,近日，女生因为吃面崩溃引发网友讨论。视频中女子控诉对象，在自己向面馆老板反映面不好吃后，对象转身就离开的行为让她感到很愤怒，似乎对象觉得自己让他丢人了。,43108756,511,https://m.weibo.cn/api/container/getIndex?containerid=231522type%3D60%26q%3D%23觉得饭不好吃告诉老板丢人吗%23%26t%3D10&title=%E7%83%AD%E9%97%A8-%23觉得饭不好吃告诉老板丢人吗%23,https://s.weibo.com/weibo?q=%23觉得饭不好吃告诉老板丢人吗%23,2023-04-18 12:57
人非要错过才懂得怀念吗,人与人之间，真的是时只有错过了才懂得怀念和珍惜吗,2521431,1279,https://m.weibo.cn/api/container/getIndex?containerid=231522type%3D60%26q%3D%23人非要错过才懂得怀念吗%23%26t%3D10&title=%E7%83%AD%E9%97%A8-%23人非要错过才懂得怀念吗%23,https://s.weibo.com/weibo?q=%23人非要错过才懂得怀念吗%23,2023-04-18 12:57
武大靖说甜豆腐脑能吃吗,《奔跑吧》武大靖说甜豆腐脑能吃吗？哈哈哈看来甜咸豆腐脑之争在武大靖这里是不存在的[doge],607199,393,https://m.weibo.cn/api/container/getIndex?containerid=231522type%3D60%26q%3D%23武大靖说甜豆腐脑能吃吗%23%26t%3D10&title=%E7%83%AD%E9%97%A8-%23武大靖说甜豆腐脑能吃吗%23,https://s.weibo.com/weibo?q=%23武大靖说甜豆腐脑能吃吗%23,2023-04-18 12:57
爱很美味为何值得更高票房,《爱很美味》电影版承袭了剧版的优点，对于女性议题的表现尺度和思考深度都超越了市面上的绝大部分国产影视剧。,2170749,197,https://m.weibo.cn/api/container/getIndex?containerid=231522type%3D60%26q%3D%23爱很美味为何值得更高票房%23%26t%3D10&title=%E7%83%AD%E9%97%A8-%23爱很美味为何值得更高票房%23,https://s.weibo.com/weibo?q=%23爱很美味为何值得更高票房%23,2023-04-18 12:57
你是高度敏感的人吗,你是高度敏感的人吗,4797840,4082,https://m.weibo.cn/api/container/getIndex?containerid=231522type%3D60%26q%3D%23你是高度敏感的人吗%23%26t%3D10&title=%E7%83%AD%E9%97%A8-%23你是高度敏感的人吗%23,https://s.weibo.com/weibo?q=%23你是高度敏感的人吗%23,2023-04-18 12:57
身材要多好才算好,身材要多好才算好？咱就是说，自信的起来是最好的！,7094627,1206,https://m.weibo.cn/api/container/getIndex?containerid=231522type%3D60%26q%3D%23身材要多好才算好%23%26t%3D10&title=%E7%83%AD%E9%97%A8-%23身材要多好才算好%23,https://s.weibo.com/weibo?q=%23身材要多好才算好%23,2023-04-18 12:57
你会让长辈帮忙带娃吗,江苏镇江，袁阿姨喜欢骑单车，退休后儿媳给她报了个单车俱乐部，她从此爱上骑游。12年来，袁阿姨带着帐篷衣物和锅碗瓢盆，累计骑行超10万公里。,2217382,83,https://m.weibo.cn/api/container/getIndex?containerid=231522type%3D60%26q%3D%23你会让长辈帮忙带娃吗%23%26t%3D10&title=%E7%83%AD%E9%97%A8-%23你会让长辈帮忙带娃吗%23,https://s.weibo.com/weibo?q=%23你会让长辈帮忙带娃吗%23,2023-04-18 12:57
你害怕被年轻同事取代吗,《欢乐颂4》朱喆遇到比自己更年轻更有才华的竞争对手，感叹后生可畏的同时又不遗余力帮她，话说朱姐你真的不怕被取代吗？,6309558,3889,https://m.weibo.cn/api/container/getIndex?containerid=231522type%3D60%26q%3D%23你害怕被年轻同事取代吗%23%26t%3D10&title=%E7%83%AD%E9%97%A8-%23你害怕被年轻同事取代吗%23,https://s.weibo.com/weibo?q=%23你害怕被年轻同事取代吗%23,2023-04-18 12:57
叶夕雾问难道这就是攻略和反攻略吗,《长月烬明》叶夕雾问难道这就是攻略和反攻略吗？？,641639,421,https://m.weibo.cn/api/container/getIndex?containerid=231522type%3D60%26q%3D%23叶夕雾问难道这就是攻略和反攻略吗%23%26t%3D10&title=%E7%83%AD%E9%97%A8-%23叶夕雾问难道这就是攻略和反攻略吗%23,https://s.weibo.com/weibo?q=%23叶夕雾问难道这就是攻略和反攻略吗%23,2023-04-18 12:57
丹阳是怎么成为眼镜之都的,据悉，全世界每两副眼镜中，就有一副就来自丹阳，你知道丹阳是怎么成为眼镜之都的吗？,1561804,246,https://m.weibo.cn/api/container/getIndex?containerid=231522type%3D60%26q%3D%23丹阳是怎么成为眼镜之都的%23%26t%3D10&title=%E7%83%AD%E9%97%A8-%23丹阳是怎么成为眼镜之都的%23,https://s.weibo.com/weibo?q=%23丹阳是怎么成为眼镜之都的%23,2023-04-18 12:57
工作后还用父母的钱算啃老吗,《欢乐颂4》叶蓁蓁和戴维工资支撑不起他们的日常消费，只能向父母求援，你认为这种行为算啃老吗？,4563257,3064,https://m.weibo.cn/api/container/getIndex?containerid=231522type%3D60%26q%3D%23工作后还用父母的钱算啃老吗%23%26t%3D10&title=%E7%83%AD%E9%97%A8-%23工作后还用父母的钱算啃老吗%23,https://s.weibo.com/weibo?q=%23工作后还用父母的钱算啃老吗%23,2023-04-18 12:57
罗云熙问澹台烬送的礼物你敢要吗,《长月烬明》罗云熙问澹台烬送的礼物你敢要吗~,716181,2119,https://m.weibo.cn/api/container/getIndex?containerid=231522type%3D60%26q%3D%23罗云熙问澹台烬送的礼物你敢要吗%23%26t%3D10&title=%E7%83%AD%E9%97%A8-%23罗云熙问澹台烬送的礼物你敢要吗%23,https://s.weibo.com/weibo?q=%23罗云熙问澹台烬送的礼物你敢要吗%23,2023-04-18 12:57
高中下晚自习后是什么感受,高中下晚自习后是什么感受,3697572,1023,https://m.weibo.cn/api/container/getIndex?containerid=231522type%3D60%26q%3D%23高中下晚自习后是什么感受%23%26t%3D10&title=%E7%83%AD%E9%97%A8-%23高中下晚自习后是什么感受%23,https://s.weibo.com/weibo?q=%23高中下晚自习后是什么感受%23,2023-04-18 12:57
什么是分享式恋爱,分享和报备的意义是不同的，分享是下意识想到的 报备是任务,4077340,2192,https://m.weibo.cn/api/container/getIndex?containerid=231522type%3D60%26q%3D%23什么是分享式恋爱%23%26t%3D10&title=%E7%83%AD%E9%97%A8-%23什么是分享式恋爱%23,https://s.weibo.com/weibo?q=%23什么是分享式恋爱%23,2023-04-18 12:57
金价拐点要来了吗,近日，国际金价持续上涨，并创下一年多来新高，直逼金价历史最高位。线上线下迎来了黄金交易热潮。,18097963,13048,https://m.weibo.cn/api/container/getIndex?containerid=231522type%3D60%26q%3D%23金价拐点要来了吗%23%26t%3D10&title=%E7%83%AD%E9%97%A8-%23金价拐点要来了吗%23,https://s.weibo.com/weibo?q=%23金价拐点要来了吗%23,2023-04-18 12:57
为何李春江李楠处罚力度有差别,上海男篮和江苏男篮均被认定消极比赛，但李春江禁赛5年，李楠禁赛3年，处罚为何不同？,64322160,160,https://m.weibo.cn/api/container/getIndex?containerid=231522type%3D60%26q%3D%23为何李春江李楠处罚力度有差别%23%26t%3D10&title=%E7%83%AD%E9%97%A8-%23为何李春江李楠处罚力度有差别%23,https://s.weibo.com/weibo?q=%23为何李春江李楠处罚力度有差别%23,2023-04-18 12:57
侮辱诽谤他人有哪些法律后果,从江秋莲处了解到，4月17日，福建南平建瓯市法院不公开开庭审理了江秋莲自诉林某侮辱、诽谤一案，以侮辱罪、诽谤罪，数罪并罚，判处被告人林某有期徒刑二年三个月。你了解侮辱诽谤他人的法律后果吗？,13552972,782,https://m.weibo.cn/api/container/getIndex?containerid=231522type%3D60%26q%3D%23侮辱诽谤他人有哪些法律后果%23%26t%3D10&title=%E7%83%AD%E9%97%A8-%23侮辱诽谤他人有哪些法律后果%23,https://s.weibo.com/weibo?q=%23侮辱诽谤他人有哪些法律后果%23,2023-04-18 12:57
还记得校运会你参加过哪些项目吗,校运会的社死瞬间。,7776247,2896,https://m.weibo.cn/api/container/getIndex?containerid=231522type%3D60%26q%3D%23还记得校运会你参加过哪些项目吗%23%26t%3D10&title=%E7%83%AD%E9%97%A8-%23还记得校运会你参加过哪些项目吗%23,https://s.weibo.com/weibo?q=%23还记得校运会你参加过哪些项目吗%23,2023-04-18 12:57
你对自己现在的学历满意吗,新东方白皮书显示，#2023年考研真实报录比约6比1#。,967357,262,https://m.weibo.cn/api/container/getIndex?containerid=231522type%3D60%26q%3D%23你对自己现在的学历满意吗%23%26t%3D10&title=%E7%83%AD%E9%97%A8-%23你对自己现在的学历满意吗%23,https://s.weibo.com/weibo?q=%23你对自己现在的学历满意吗%23,2023-04-18 12:57
存够多少钱才会有安全感,有观点认为，存款一定程度上体现个人对未来的抗风险能力，存钱会给你带来安全感吗？,466749,8,https://m.weibo.cn/api/container/getIndex?containerid=231522type%3D60%26q%3D%23存够多少钱才会有安全感%23%26t%3D10&title=%E7%83%AD%E9%97%A8-%23存够多少钱才会有安全感%23,https://s.weibo.com/weibo?q=%23存够多少钱才会有安全感%23,2023-04-18 12:57
用chatgpt写稿是种什么体验,当下，人类作者驯服ChatGPT的过程比写作本身更加痛苦和艰辛。,42612,14,https://m.weibo.cn/api/container/getIndex?containerid=231522type%3D60%26q%3D%23用chatgpt写稿是种什么体验%23%26t%3D10&title=%E7%83%AD%E9%97%A8-%23用chatgpt写稿是种什么体验%23,https://s.weibo.com/weibo?q=%23用chatgpt写稿是种什么体验%23,2023-04-18 12:57
模仿犯算悬疑剧吗,剧播一半，凶手挂了，你觉着《模仿犯》的悬疑感怎么样？,324202,118,https://m.weibo.cn/api/container/getIndex?containerid=231522type%3D60%26q%3D%23模仿犯算悬疑剧吗%23%26t%3D10&title=%E7%83%AD%E9%97%A8-%23模仿犯算悬疑剧吗%23,https://s.weibo.com/weibo?q=%23模仿犯算悬疑剧吗%23,2023-04-18 12:57
鱼刺卡喉你会去医院吗,当事人李同学介绍，自己是刚吃了一口鱼肉就被鱼刺卡喉，情急之下想喝水试图压下去，结果鱼刺越来越深。,859526,71,https://m.weibo.cn/api/container/getIndex?containerid=231522type%3D60%26q%3D%23鱼刺卡喉你会去医院吗%23%26t%3D10&title=%E7%83%AD%E9%97%A8-%23鱼刺卡喉你会去医院吗%23,https://s.weibo.com/weibo?q=%23鱼刺卡喉你会去医院吗%23,2023-04-18 12:57
