word,summary,read,mention,href,link,time_stamp
感觉新冠不再来了还用打疫苗吗,不少人近期感觉新冠病毒仿佛已经销声匿迹。去年底的新冠感染高峰，已经过去4个多月，未来是否还需要接种新冠疫苗？如何有效减少再次感染？为应对奥密克戎可能发生的突变，#2类人更需要再次接种新冠疫苗#，详戳专家科普↓  ​​​,173709911,5350,https://m.weibo.cn/api/container/getIndex?containerid=231522type%3D60%26q%3D%23感觉新冠不再来了还用打疫苗吗%23%26t%3D10&title=%E7%83%AD%E9%97%A8-%23感觉新冠不再来了还用打疫苗吗%23,https://s.weibo.com/weibo?q=%23感觉新冠不再来了还用打疫苗吗%23,2023-04-18 12:57
哪些人属于胃癌高危人群,胃癌早期症状不明显，易被忽视，但若及时发现，根治性切除后的复发率很低。哪些人属于胃癌高危人群？看↓,51103766,1874,https://m.weibo.cn/api/container/getIndex?containerid=231522type%3D60%26q%3D%23哪些人属于胃癌高危人群%23%26t%3D10&title=%E7%83%AD%E9%97%A8-%23哪些人属于胃癌高危人群%23,https://s.weibo.com/weibo?q=%23哪些人属于胃癌高危人群%23,2023-04-18 12:57
害怕生孩子是心理障碍吗,害怕生孩子是心理障碍吗？你是怎么认为的，说说你的看法,145056281,11969,https://m.weibo.cn/api/container/getIndex?containerid=231522type%3D60%26q%3D%23害怕生孩子是心理障碍吗%23%26t%3D10&title=%E7%83%AD%E9%97%A8-%23害怕生孩子是心理障碍吗%23,https://s.weibo.com/weibo?q=%23害怕生孩子是心理障碍吗%23,2023-04-18 12:57
睡不好对颜值影响有多大,晚上睡不着，白天睡不醒。《中国睡眠大数据报告》显示，白天易犯困、入睡难、睡眠质量差，成为困扰当代年轻人的三大睡眠问题。长期睡眠不足，甚至会直接影响到姣好的容貌，你遇到过类似的烦恼吗？,101664653,14020,https://m.weibo.cn/api/container/getIndex?containerid=231522type%3D60%26q%3D%23睡不好对颜值影响有多大%23%26t%3D10&title=%E7%83%AD%E9%97%A8-%23睡不好对颜值影响有多大%23,https://s.weibo.com/weibo?q=%23睡不好对颜值影响有多大%23,2023-04-18 12:57
山东为什么突然火了,近期山东多地爆火，旅游经济出圈。究竟是做对了什么？,2082219,7945,https://m.weibo.cn/api/container/getIndex?containerid=231522type%3D60%26q%3D%23山东为什么突然火了%23%26t%3D10&title=%E7%83%AD%E9%97%A8-%23山东为什么突然火了%23,https://s.weibo.com/weibo?q=%23山东为什么突然火了%23,2023-04-18 12:57
什么是智能汽车天花板,随着科学技术的发展，汽车正在改变人类未来出行方式，中国智能汽车的天花板到底有多高？让我们一探究竟！,96491178,24971,https://m.weibo.cn/api/container/getIndex?containerid=231522type%3D60%26q%3D%23什么是智能汽车天花板%23%26t%3D10&title=%E7%83%AD%E9%97%A8-%23什么是智能汽车天花板%23,https://s.weibo.com/weibo?q=%23什么是智能汽车天花板%23,2023-04-18 12:57
现在的笔都这么高级了吗,这就是所谓的差生文具多吧，在哪买的我很需要,29322264,3019,https://m.weibo.cn/api/container/getIndex?containerid=231522type%3D60%26q%3D%23现在的笔都这么高级了吗%23%26t%3D10&title=%E7%83%AD%E9%97%A8-%23现在的笔都这么高级了吗%23,https://s.weibo.com/weibo?q=%23现在的笔都这么高级了吗%23,2023-04-18 12:57
这些癌症都有哪些信号,专家教你根据不同癌症的“性格”，有针对性地做好预防。,64036281,3743,https://m.weibo.cn/api/container/getIndex?containerid=231522type%3D60%26q%3D%23这些癌症都有哪些信号%23%26t%3D10&title=%E7%83%AD%E9%97%A8-%23这些癌症都有哪些信号%23,https://s.weibo.com/weibo?q=%23这些癌症都有哪些信号%23,2023-04-18 12:57
这不就是我上班的心态吗,慢慢熬吧，与君共勉,813995,1092,https://m.weibo.cn/api/container/getIndex?containerid=231522type%3D60%26q%3D%23这不就是我上班的心态吗%23%26t%3D10&title=%E7%83%AD%E9%97%A8-%23这不就是我上班的心态吗%23,https://s.weibo.com/weibo?q=%23这不就是我上班的心态吗%23,2023-04-18 12:57
什么工作可以上半年休半年,休半年有钱拿吗？没钱的话......还有什么意思~,170391444,5673,https://m.weibo.cn/api/container/getIndex?containerid=231522type%3D60%26q%3D%23什么工作可以上半年休半年%23%26t%3D10&title=%E7%83%AD%E9%97%A8-%23什么工作可以上半年休半年%23,https://s.weibo.com/weibo?q=%23什么工作可以上半年休半年%23,2023-04-18 12:57
你觉得考研录取难度有变化吗,新东方近日发布《2024中国大学生考研白皮书》，梳理各招生单位官方公布的统考招生名额，在招生数据中去除保研招生名额后，计算出了2022年和2023年考研的真实报录比，分别为5.6和5.7,3680085,430,https://m.weibo.cn/api/container/getIndex?containerid=231522type%3D60%26q%3D%23你觉得考研录取难度有变化吗%23%26t%3D10&title=%E7%83%AD%E9%97%A8-%23你觉得考研录取难度有变化吗%23,https://s.weibo.com/weibo?q=%23你觉得考研录取难度有变化吗%23,2023-04-18 12:57
为什么肝癌通常一发现就是晚期,日常护肝要注意什么？为什么肝癌通常一发现就是晚期？央视新闻《医学公开课》，邀请医生在线为你解答↓,187392337,8126,https://m.weibo.cn/api/container/getIndex?containerid=231522type%3D60%26q%3D%23为什么肝癌通常一发现就是晚期%23%26t%3D10&title=%E7%83%AD%E9%97%A8-%23为什么肝癌通常一发现就是晚期%23,https://s.weibo.com/weibo?q=%23为什么肝癌通常一发现就是晚期%23,2023-04-18 12:57
恋爱脑知道自己是恋爱脑吗,如今，网络上对一个人最“恶毒”的诅咒，恐怕就是祝福ta患上“恋爱脑”。到底什么是“恋爱脑”？“恋爱脑”知道自己是“恋爱脑”吗？,17187346,1035,https://m.weibo.cn/api/container/getIndex?containerid=231522type%3D60%26q%3D%23恋爱脑知道自己是恋爱脑吗%23%26t%3D10&title=%E7%83%AD%E9%97%A8-%23恋爱脑知道自己是恋爱脑吗%23,https://s.weibo.com/weibo?q=%23恋爱脑知道自己是恋爱脑吗%23,2023-04-18 12:57
为啥动物遇消防员就变成乖宝宝,云南安宁，消防员在扑灭山火的过程中，遇到一只被烧伤的小野猪。消防员为它清理包扎伤口，给它喂苹果。,5724124,477,https://m.weibo.cn/api/container/getIndex?containerid=231522type%3D60%26q%3D%23为啥动物遇消防员就变成乖宝宝%23%26t%3D10&title=%E7%83%AD%E9%97%A8-%23为啥动物遇消防员就变成乖宝宝%23,https://s.weibo.com/weibo?q=%23为啥动物遇消防员就变成乖宝宝%23,2023-04-18 12:57
长期睡不好有哪些危害,你知道睡眠障碍都有哪些危害吗？如何判断自己算不算失眠？怎样拯救睡眠障碍？戳↓↓,7338602,1742,https://m.weibo.cn/api/container/getIndex?containerid=231522type%3D60%26q%3D%23长期睡不好有哪些危害%23%26t%3D10&title=%E7%83%AD%E9%97%A8-%23长期睡不好有哪些危害%23,https://s.weibo.com/weibo?q=%23长期睡不好有哪些危害%23,2023-04-18 12:57
如何看待新能源汽车频繁降价,最近新能源车频繁降价，你怎么看呢？,37947,34,https://m.weibo.cn/api/container/getIndex?containerid=231522type%3D60%26q%3D%23如何看待新能源汽车频繁降价%23%26t%3D10&title=%E7%83%AD%E9%97%A8-%23如何看待新能源汽车频繁降价%23,https://s.weibo.com/weibo?q=%23如何看待新能源汽车频繁降价%23,2023-04-18 12:57
90后体面养老需要攒多少钱,你对自己的老年生活有怎样的规划？,134998,23,https://m.weibo.cn/api/container/getIndex?containerid=231522type%3D60%26q%3D%2390后体面养老需要攒多少钱%23%26t%3D10&title=%E7%83%AD%E9%97%A8-%2390后体面养老需要攒多少钱%23,https://s.weibo.com/weibo?q=%2390后体面养老需要攒多少钱%23,2023-04-18 12:57
你见过土拨鼠打架吗,难 分 难 舍,1369106,735,https://m.weibo.cn/api/container/getIndex?containerid=231522type%3D60%26q%3D%23你见过土拨鼠打架吗%23%26t%3D10&title=%E7%83%AD%E9%97%A8-%23你见过土拨鼠打架吗%23,https://s.weibo.com/weibo?q=%23你见过土拨鼠打架吗%23,2023-04-18 12:57
下次换罗云熙扔东西行吗,下次换罗云熙扔东西行吗,3108682,576,https://m.weibo.cn/api/container/getIndex?containerid=231522type%3D60%26q%3D%23下次换罗云熙扔东西行吗%23%26t%3D10&title=%E7%83%AD%E9%97%A8-%23下次换罗云熙扔东西行吗%23,https://s.weibo.com/weibo?q=%23下次换罗云熙扔东西行吗%23,2023-04-18 12:57
智能驾驶会让你更安心吗,你了解并信任智能驾驶吗？在智能驾驶大热的当下，你又对此有什么看法呢？和网友一起来聊聊吧。,116760916,71173,https://m.weibo.cn/api/container/getIndex?containerid=231522type%3D60%26q%3D%23智能驾驶会让你更安心吗%23%26t%3D10&title=%E7%83%AD%E9%97%A8-%23智能驾驶会让你更安心吗%23,https://s.weibo.com/weibo?q=%23智能驾驶会让你更安心吗%23,2023-04-18 12:57
真正结束一段关系是怎样的,真正结束一段关系最好的方式是怎样的，一起聊聊吧！,5614787,5231,https://m.weibo.cn/api/container/getIndex?containerid=231522type%3D60%26q%3D%23真正结束一段关系是怎样的%23%26t%3D10&title=%E7%83%AD%E9%97%A8-%23真正结束一段关系是怎样的%23,https://s.weibo.com/weibo?q=%23真正结束一段关系是怎样的%23,2023-04-18 12:57
为什么说分手应该体面,你认为最体面的分手方式是什么？,310323,801,https://m.weibo.cn/api/container/getIndex?containerid=231522type%3D60%26q%3D%23为什么说分手应该体面%23%26t%3D10&title=%E7%83%AD%E9%97%A8-%23为什么说分手应该体面%23,https://s.weibo.com/weibo?q=%23为什么说分手应该体面%23,2023-04-18 12:57
还有必要去韩国整容医美吗,大家还会去韩国整容医美吗？,2437917,969,https://m.weibo.cn/api/container/getIndex?containerid=231522type%3D60%26q%3D%23还有必要去韩国整容医美吗%23%26t%3D10&title=%E7%83%AD%E9%97%A8-%23还有必要去韩国整容医美吗%23,https://s.weibo.com/weibo?q=%23还有必要去韩国整容医美吗%23,2023-04-18 12:57
你是正常缴纳社保吗,5月1日起，《社会保险基金监督举报工作管理办法》将正式实施。,2390195,307,https://m.weibo.cn/api/container/getIndex?containerid=231522type%3D60%26q%3D%23你是正常缴纳社保吗%23%26t%3D10&title=%E7%83%AD%E9%97%A8-%23你是正常缴纳社保吗%23,https://s.weibo.com/weibo?q=%23你是正常缴纳社保吗%23,2023-04-18 12:57
错过一个很爱的人是怎样的,你有错过一个很爱的人的经历吗，是因为什么原因而错过的呢？,25370116,4115,https://m.weibo.cn/api/container/getIndex?containerid=231522type%3D60%26q%3D%23错过一个很爱的人是怎样的%23%26t%3D10&title=%E7%83%AD%E9%97%A8-%23错过一个很爱的人是怎样的%23,https://s.weibo.com/weibo?q=%23错过一个很爱的人是怎样的%23,2023-04-18 12:57
什么花容易引发过敏,靠风传粉的“风媒花”，让大量花粉飘浮在空气中，当表面含有蛋白质的花粉进入人体呼吸道时，就会引起人的免疫反应，出现过敏现象。,808468,166,https://m.weibo.cn/api/container/getIndex?containerid=231522type%3D60%26q%3D%23什么花容易引发过敏%23%26t%3D10&title=%E7%83%AD%E9%97%A8-%23什么花容易引发过敏%23,https://s.weibo.com/weibo?q=%23什么花容易引发过敏%23,2023-04-18 12:57
激光雷达是智商税吗,如今，激光雷达可谓是“全知全能”的汽车眼，在安全、智能领域发挥着重要作用。激光雷达是智商税吗？它如何保障智慧出行？,150910126,53746,https://m.weibo.cn/api/container/getIndex?containerid=231522type%3D60%26q%3D%23激光雷达是智商税吗%23%26t%3D10&title=%E7%83%AD%E9%97%A8-%23激光雷达是智商税吗%23,https://s.weibo.com/weibo?q=%23激光雷达是智商税吗%23,2023-04-18 12:57
真正爱一个人会渴望结婚吗,爱一个人会渴望和对方结婚吗？一起分享分享吧。,12487897,6393,https://m.weibo.cn/api/container/getIndex?containerid=231522type%3D60%26q%3D%23真正爱一个人会渴望结婚吗%23%26t%3D10&title=%E7%83%AD%E9%97%A8-%23真正爱一个人会渴望结婚吗%23,https://s.weibo.com/weibo?q=%23真正爱一个人会渴望结婚吗%23,2023-04-18 12:57
陪嫁是婚后的底气吗,"每当情侣计划结婚时，""双边关系""就变成了两个家庭的""多边关系""，而""钱""是大小事项的基础，争议的焦点也几乎围绕于此。都说一个可以依靠的娘家，是女人出嫁后最大的底气。那么你觉得婚后的底气是什么呢？",1993604,1209,https://m.weibo.cn/api/container/getIndex?containerid=231522type%3D60%26q%3D%23陪嫁是婚后的底气吗%23%26t%3D10&title=%E7%83%AD%E9%97%A8-%23陪嫁是婚后的底气吗%23,https://s.weibo.com/weibo?q=%23陪嫁是婚后的底气吗%23,2023-04-18 12:57
大学生发起疯来有多离谱,发疯文学，已经被大学生们狠狠拿捏！拒绝精神内耗，遇事向外发疯！,5401665,3356,https://m.weibo.cn/api/container/getIndex?containerid=231522type%3D60%26q%3D%23大学生发起疯来有多离谱%23%26t%3D10&title=%E7%83%AD%E9%97%A8-%23大学生发起疯来有多离谱%23,https://s.weibo.com/weibo?q=%23大学生发起疯来有多离谱%23,2023-04-18 12:57
AI换脸存在哪些乱象和风险,随着人工智能的发展，“AI换脸”技术门槛逐渐降低，应用场景越来越多，在满足人们猎奇、美颜、社交等需求的同时，因“AI换脸”引发的争议乃至违法犯罪行为屡见不鲜，其背后隐藏的黑灰产业链也逐渐浮出水面。“AI换脸”存在哪些乱象？用明星形象AI换脸是否合法？技术应用的边界在哪？,100633,160,https://m.weibo.cn/api/container/getIndex?containerid=231522type%3D60%26q%3D%23AI换脸存在哪些乱象和风险%23%26t%3D10&title=%E7%83%AD%E9%97%A8-%23AI换脸存在哪些乱象和风险%23,https://s.weibo.com/weibo?q=%23AI换脸存在哪些乱象和风险%23,2023-04-18 12:57
今年五一你抢票了吗,12306网站显示，从南京出发去往一些热门城市的火车票基本售罄，新晋“网红”城市淄博的火车票更是“秒光”。,3292154,3629,https://m.weibo.cn/api/container/getIndex?containerid=231522type%3D60%26q%3D%23今年五一你抢票了吗%23%26t%3D10&title=%E7%83%AD%E9%97%A8-%23今年五一你抢票了吗%23,https://s.weibo.com/weibo?q=%23今年五一你抢票了吗%23,2023-04-18 12:57
五一抢票如何正确候补,“五一”假期准备出行的你，抢到火车票了吗？多家旅游平台数据显示，“五一”火车票已经“卖爆了”。有网友感慨，今年“五一”抢火车票的难度堪比春运。,4764270,19474,https://m.weibo.cn/api/container/getIndex?containerid=231522type%3D60%26q%3D%23五一抢票如何正确候补%23%26t%3D10&title=%E7%83%AD%E9%97%A8-%23五一抢票如何正确候补%23,https://s.weibo.com/weibo?q=%23五一抢票如何正确候补%23,2023-04-18 12:57
如今泼水节的玩法涉嫌性骚扰吗,近期有网友和媒体贴出多张泼水节活动照片，称多名女性被男性用水枪泼水，“颜值越高被泼得越凶”，涉嫌性骚扰，让泼水节“变了味儿”。对此，你怎么看？,51071079,1089,https://m.weibo.cn/api/container/getIndex?containerid=231522type%3D60%26q%3D%23如今泼水节的玩法涉嫌性骚扰吗%23%26t%3D10&title=%E7%83%AD%E9%97%A8-%23如今泼水节的玩法涉嫌性骚扰吗%23,https://s.weibo.com/weibo?q=%23如今泼水节的玩法涉嫌性骚扰吗%23,2023-04-18 12:57
你会为了另一半和好友绝交吗,《欢乐颂4》戚牧挑拨何悯鸿远离室友令人气愤不已，而现实中，你会为了另一半和好友绝交吗？,34824741,3380,https://m.weibo.cn/api/container/getIndex?containerid=231522type%3D60%26q%3D%23你会为了另一半和好友绝交吗%23%26t%3D10&title=%E7%83%AD%E9%97%A8-%23你会为了另一半和好友绝交吗%23,https://s.weibo.com/weibo?q=%23你会为了另一半和好友绝交吗%23,2023-04-18 12:57
前任请你参加婚礼要去吗,《龙城》白宇演的郑西决女友变小婶，所以前任请你参加婚礼要去吗？,40771292,4350,https://m.weibo.cn/api/container/getIndex?containerid=231522type%3D60%26q%3D%23前任请你参加婚礼要去吗%23%26t%3D10&title=%E7%83%AD%E9%97%A8-%23前任请你参加婚礼要去吗%23,https://s.weibo.com/weibo?q=%23前任请你参加婚礼要去吗%23,2023-04-18 12:57
为什么你不想上班,你不想上班的原因是什么,1771152,1764,https://m.weibo.cn/api/container/getIndex?containerid=231522type%3D60%26q%3D%23为什么你不想上班%23%26t%3D10&title=%E7%83%AD%E9%97%A8-%23为什么你不想上班%23,https://s.weibo.com/weibo?q=%23为什么你不想上班%23,2023-04-18 12:57
春天为什么总是短暂,据江苏气象，4月17日气温继续回升，多地气温将突破30℃，最高将达33℃。18日将有雷阵雨天气，届时气温稍稍回落，最高温淮河以南地区30℃左右，其他地区28～29℃。春天为什么总是短暂[苦涩]户外注意防晒。 ​,3765759,678,https://m.weibo.cn/api/container/getIndex?containerid=231522type%3D60%26q%3D%23春天为什么总是短暂%23%26t%3D10&title=%E7%83%AD%E9%97%A8-%23春天为什么总是短暂%23,https://s.weibo.com/weibo?q=%23春天为什么总是短暂%23,2023-04-18 12:57
当前哪些人群仍需接种新冠疫苗,随着疫情形势的变化，现阶段是否需要接种疫苗要根据感染情况、既往接种史以及年龄、身体状况等因素确定。,1109356,30,https://m.weibo.cn/api/container/getIndex?containerid=231522type%3D60%26q%3D%23当前哪些人群仍需接种新冠疫苗%23%26t%3D10&title=%E7%83%AD%E9%97%A8-%23当前哪些人群仍需接种新冠疫苗%23,https://s.weibo.com/weibo?q=%23当前哪些人群仍需接种新冠疫苗%23,2023-04-18 12:57
做月嫂真的能赚钱吗,4月14日，“女儿发现做月嫂的妈妈存款近500万”的新闻引发讨论。15日，用户@cryin-rong 发文辟谣：“没想到我老公3月28日发了一条我婆婆银行卡余额竟然成为了热搜。在这儿我给大家辟谣一下，这是一条被炮制出来的假新闻。”,18670449,445,https://m.weibo.cn/api/container/getIndex?containerid=231522type%3D60%26q%3D%23做月嫂真的能赚钱吗%23%26t%3D10&title=%E7%83%AD%E9%97%A8-%23做月嫂真的能赚钱吗%23,https://s.weibo.com/weibo?q=%23做月嫂真的能赚钱吗%23,2023-04-18 12:57
你认为杂技表演该取消吗,4月15日，安徽宿州埇桥区蒿沟镇一场演出现场，女杂技演员表演时从高空坠亡，引发关注。你认为杂技表演该取消吗？,34570569,534,https://m.weibo.cn/api/container/getIndex?containerid=231522type%3D60%26q%3D%23你认为杂技表演该取消吗%23%26t%3D10&title=%E7%83%AD%E9%97%A8-%23你认为杂技表演该取消吗%23,https://s.weibo.com/weibo?q=%23你认为杂技表演该取消吗%23,2023-04-18 12:57
假如父母患癌我该如何告知,假如父母得了癌症我应该怎么告诉他呢？,979681,734,https://m.weibo.cn/api/container/getIndex?containerid=231522type%3D60%26q%3D%23假如父母患癌我该如何告知%23%26t%3D10&title=%E7%83%AD%E9%97%A8-%23假如父母患癌我该如何告知%23,https://s.weibo.com/weibo?q=%23假如父母患癌我该如何告知%23,2023-04-18 12:57
白鹿问养钉子也会情丝买一赠一吗,白鹿问养钉子也会情丝买一赠一吗？,590083,263,https://m.weibo.cn/api/container/getIndex?containerid=231522type%3D60%26q%3D%23白鹿问养钉子也会情丝买一赠一吗%23%26t%3D10&title=%E7%83%AD%E9%97%A8-%23白鹿问养钉子也会情丝买一赠一吗%23,https://s.weibo.com/weibo?q=%23白鹿问养钉子也会情丝买一赠一吗%23,2023-04-18 12:57
你担心ai未来的走向吗,人们为AI狂飙的智力能力欢呼的同时，又对不可捉摸和预测的风险感到畏惧。你担心AI未来的走向吗？,177267,28,https://m.weibo.cn/api/container/getIndex?containerid=231522type%3D60%26q%3D%23你担心ai未来的走向吗%23%26t%3D10&title=%E7%83%AD%E9%97%A8-%23你担心ai未来的走向吗%23,https://s.weibo.com/weibo?q=%23你担心ai未来的走向吗%23,2023-04-18 12:57
平时你习惯使用白噪音吗,雨声、海浪声等，都很接近功率频谱密度相对均匀的白噪音。这类声音可以与大脑发生谐振，令大脑平复至安静状态，产生催眠效果。,443922,80,https://m.weibo.cn/api/container/getIndex?containerid=231522type%3D60%26q%3D%23平时你习惯使用白噪音吗%23%26t%3D10&title=%E7%83%AD%E9%97%A8-%23平时你习惯使用白噪音吗%23,https://s.weibo.com/weibo?q=%23平时你习惯使用白噪音吗%23,2023-04-18 12:57
马斯克能改写太空探索吗,北京时间4月17日消息，美国东部时间周一8点(北京时间周一20点)，SpaceX的“星际飞船”将迎来它的首次轨道级试飞。这次发射任务至关重要，它不但关系到马斯克的火星梦，还会影响美国的重返月球计划。,3853837,436,https://m.weibo.cn/api/container/getIndex?containerid=231522type%3D60%26q%3D%23马斯克能改写太空探索吗%23%26t%3D10&title=%E7%83%AD%E9%97%A8-%23马斯克能改写太空探索吗%23,https://s.weibo.com/weibo?q=%23马斯克能改写太空探索吗%23,2023-04-18 12:57
在东北你是不是有这样一个姥爷,在东北，你是不是也有这样的一位姥爷？如果有，那就请常回家看看吧～～（视频来,1705468,58,https://m.weibo.cn/api/container/getIndex?containerid=231522type%3D60%26q%3D%23在东北你是不是有这样一个姥爷%23%26t%3D10&title=%E7%83%AD%E9%97%A8-%23在东北你是不是有这样一个姥爷%23,https://s.weibo.com/weibo?q=%23在东北你是不是有这样一个姥爷%23,2023-04-18 12:57
视听类App能否只收一次费,当前不少视听类App存在类似的资源不互通、“套娃式”收费等现象，一些消费者对此叫苦不迭。,2624341,284,https://m.weibo.cn/api/container/getIndex?containerid=231522type%3D60%26q%3D%23视听类App能否只收一次费%23%26t%3D10&title=%E7%83%AD%E9%97%A8-%23视听类App能否只收一次费%23,https://s.weibo.com/weibo?q=%23视听类App能否只收一次费%23,2023-04-18 12:57
如何看待怼脸拍摄女友哭泣过程,一则#女生因为吃面崩溃# 的话题冲上热搜。网友对此纷纷发表了自己的看法。对此，你怎么看？,21128003,353,https://m.weibo.cn/api/container/getIndex?containerid=231522type%3D60%26q%3D%23如何看待怼脸拍摄女友哭泣过程%23%26t%3D10&title=%E7%83%AD%E9%97%A8-%23如何看待怼脸拍摄女友哭泣过程%23,https://s.weibo.com/weibo?q=%23如何看待怼脸拍摄女友哭泣过程%23,2023-04-18 12:57
彭冠英自己演的能不关注吗,彭冠英真内娱喜剧人人设，回复《薄冰》微博系统评论的演员，真内娱第一人，要被他笑死！,2561063,1632,https://m.weibo.cn/api/container/getIndex?containerid=231522type%3D60%26q%3D%23彭冠英自己演的能不关注吗%23%26t%3D10&title=%E7%83%AD%E9%97%A8-%23彭冠英自己演的能不关注吗%23,https://s.weibo.com/weibo?q=%23彭冠英自己演的能不关注吗%23,2023-04-18 12:57
如何看待泼水节变了味,如何看待泼水节变了味？,3981299,178,https://m.weibo.cn/api/container/getIndex?containerid=231522type%3D60%26q%3D%23如何看待泼水节变了味%23%26t%3D10&title=%E7%83%AD%E9%97%A8-%23如何看待泼水节变了味%23,https://s.weibo.com/weibo?q=%23如何看待泼水节变了味%23,2023-04-18 12:57
整个福建都在吃笋吗,每到春天，福建人餐桌上的含笋量就直线上升，各地鲜美笋味让人停不下筷子。,1048477,198,https://m.weibo.cn/api/container/getIndex?containerid=231522type%3D60%26q%3D%23整个福建都在吃笋吗%23%26t%3D10&title=%E7%83%AD%E9%97%A8-%23整个福建都在吃笋吗%23,https://s.weibo.com/weibo?q=%23整个福建都在吃笋吗%23,2023-04-18 12:57
福建春日含笋量有多少,感觉福建春日含笋量超标，快点一起来吃春笋吧,9315669,251,https://m.weibo.cn/api/container/getIndex?containerid=231522type%3D60%26q%3D%23福建春日含笋量有多少%23%26t%3D10&title=%E7%83%AD%E9%97%A8-%23福建春日含笋量有多少%23,https://s.weibo.com/weibo?q=%23福建春日含笋量有多少%23,2023-04-18 12:57
真正放下一个人是什么体验,真正放下一个人是什么体验？一起聊聊吧。,11357390,5908,https://m.weibo.cn/api/container/getIndex?containerid=231522type%3D60%26q%3D%23真正放下一个人是什么体验%23%26t%3D10&title=%E7%83%AD%E9%97%A8-%23真正放下一个人是什么体验%23,https://s.weibo.com/weibo?q=%23真正放下一个人是什么体验%23,2023-04-18 12:57
泼水节男子围着女子泼水撕雨衣属于性骚扰吗,女子泼水节遭众男子围着泼水撕雨衣事件，引发大家关注，你认为在泼水节上男子围着女子泼水撕雨衣属于性骚扰吗？,985571,43,https://m.weibo.cn/api/container/getIndex?containerid=231522type%3D60%26q%3D%23泼水节男子围着女子泼水撕雨衣属于性骚扰吗%23%26t%3D10&title=%E7%83%AD%E9%97%A8-%23泼水节男子围着女子泼水撕雨衣属于性骚扰吗%23,https://s.weibo.com/weibo?q=%23泼水节男子围着女子泼水撕雨衣属于性骚扰吗%23,2023-04-18 12:57
久坐会让身体发生哪些变化,工作、追剧、趴着睡觉……一个人一天中，坐着的时间真不少。如果每天坐姿超8小时、一周内超过5天，或连续静坐2小时不动弹，就称得上“久坐”，斜躺姿势也算在内。随着时间的延长，久坐的伤害也且呈现出渐进的过程。,6146553,1398,https://m.weibo.cn/api/container/getIndex?containerid=231522type%3D60%26q%3D%23久坐会让身体发生哪些变化%23%26t%3D10&title=%E7%83%AD%E9%97%A8-%23久坐会让身体发生哪些变化%23,https://s.weibo.com/weibo?q=%23久坐会让身体发生哪些变化%23,2023-04-18 12:57
