话题名称,阅读量,讨论量,链接
加班文化为啥屡禁不止,273757550,36689,https://s.weibo.com/weibo?q=%23加班文化为啥屡禁不止%23
网友为何高度关注孙国友事件,2807812,130,https://s.weibo.com/weibo?q=%23网友为何高度关注孙国友事件%23
你认为儿童玩手机成瘾问题严重吗,7444125,492,https://s.weibo.com/weibo?q=%23你认为儿童玩手机成瘾问题严重吗%23
恋爱中合适与喜欢哪个更重要,311595,2383,https://s.weibo.com/weibo?q=%23恋爱中合适与喜欢哪个更重要%23
租来的房子有必要装修吗,106533461,8078,https://s.weibo.com/weibo?q=%23租来的房子有必要装修吗%23
上班了还穿学生时代的衣服吗,5279243,4744,https://s.weibo.com/weibo?q=%23上班了还穿学生时代的衣服吗%23
乐华七子会解散吗,63168304,3640,https://s.weibo.com/weibo?q=%23乐华七子会解散吗%23
飞絮为什么难治理,650631,158,https://s.weibo.com/weibo?q=%23飞絮为什么难治理%23
为什么说总要去一次上海,58778509,3265,https://s.weibo.com/weibo?q=%23为什么说总要去一次上海%23
固定工位未来会不会消失,1079507,169,https://s.weibo.com/weibo?q=%23固定工位未来会不会消失%23
相反性格的两个人会幸福吗,530076,1003,https://s.weibo.com/weibo?q=%23相反性格的两个人会幸福吗%23
如何调理当代年轻人的精神状态,5164279,4424,https://s.weibo.com/weibo?q=%23如何调理当代年轻人的精神状态%23
你想要双休还是凑小长假,282820948,10515,https://s.weibo.com/weibo?q=%23你想要双休还是凑小长假%23
考研考公找工作哪样难度最大,1042772,90,https://s.weibo.com/weibo?q=%23考研考公找工作哪样难度最大%23
如何评价长月烬明OST阵容,355635,275,https://s.weibo.com/weibo?q=%23如何评价长月烬明OST阵容%23
街访上海老人如何看待死亡,5521976,274,https://s.weibo.com/weibo?q=%23街访上海老人如何看待死亡%23
你知道哪些清明节习俗,804435,267,https://s.weibo.com/weibo?q=%23你知道哪些清明节习俗%23
生活被工作填满是否要辞职,4310602,1657,https://s.weibo.com/weibo?q=%23生活被工作填满是否要辞职%23
请问今天范丞丞单飞了没,815319,499,https://s.weibo.com/weibo?q=%23请问今天范丞丞单飞了没%23
你每天工作超过8小时了吗,794770,171,https://s.weibo.com/weibo?q=%23你每天工作超过8小时了吗%23
张继科事件对各行业的启示,9834435,105,https://s.weibo.com/weibo?q=%23张继科事件对各行业的启示%23
春季护肤需要注意什么问题,1821688,1114,https://s.weibo.com/weibo?q=%23春季护肤需要注意什么问题%23
张继科事件的注意力该放在哪里,366522,106,https://s.weibo.com/weibo?q=%23张继科事件的注意力该放在哪里%23
张继科事件为何愈演愈烈,1224886,146,https://s.weibo.com/weibo?q=%23张继科事件为何愈演愈烈%23
为什么不要和异性频繁聊天,141092,3353,https://s.weibo.com/weibo?q=%23为什么不要和异性频繁聊天%23
你遇到过什么形式的加班,1108299,132,https://s.weibo.com/weibo?q=%23你遇到过什么形式的加班%23
你为什么选择结婚,8994645,1458,https://s.weibo.com/weibo?q=%23你为什么选择结婚%23
古人春游什么样,6709630,2235,https://s.weibo.com/weibo?q=%23古人春游什么样%23
当代年轻人睡得有多晚,5527231,270,https://s.weibo.com/weibo?q=%23当代年轻人睡得有多晚%23
你和配偶是如何处理财产的,7879334,1236,https://s.weibo.com/weibo?q=%23你和配偶是如何处理财产的%23
为什么深海鱼没有容貌焦虑,34949538,2563,https://s.weibo.com/weibo?q=%23为什么深海鱼没有容貌焦虑%23
有必要为了孩子延续婚姻吗,2436616,3422,https://s.weibo.com/weibo?q=%23有必要为了孩子延续婚姻吗%23
你支持上二休一上二再休二吗,118562,39,https://s.weibo.com/weibo?q=%23你支持上二休一上二再休二吗%23
你有存款焦虑吗,6241882,625,https://s.weibo.com/weibo?q=%23你有存款焦虑吗%23
预防甲流该怎么做,11404336,689,https://s.weibo.com/weibo?q=%23预防甲流该怎么做%23
为何大家说杭州是美食荒漠,157393706,2312,https://s.weibo.com/weibo?q=%23为何大家说杭州是美食荒漠%23
如何应对职场加班文化,408241,546,https://s.weibo.com/weibo?q=%23如何应对职场加班文化%23
买房和租房哪个更幸福,297825,1426,https://s.weibo.com/weibo?q=%23买房和租房哪个更幸福%23
为什么和平年代同样需要英雄情怀,69825164,2051,https://s.weibo.com/weibo?q=%23为什么和平年代同样需要英雄情怀%23
你会喜欢每天陪你聊天的人吗,460107,1613,https://s.weibo.com/weibo?q=%23你会喜欢每天陪你聊天的人吗%23
你想不到的小说作者主业,83697334,1201,https://s.weibo.com/weibo?q=%23你想不到的小说作者主业%23
运动员退役必须要官宣吗,65365786,1110,https://s.weibo.com/weibo?q=%23运动员退役必须要官宣吗%23
能接受好朋友跟前任交往吗,4370942,2342,https://s.weibo.com/weibo?q=%23能接受好朋友跟前任交往吗%23
和孩子聊死亡你怕了吗,6711114,1254,https://s.weibo.com/weibo?q=%23和孩子聊死亡你怕了吗%23
年轻人开始立遗嘱了吗,1400073,65,https://s.weibo.com/weibo?q=%23年轻人开始立遗嘱了吗%23
放弃治疗而进行临终关怀是不孝吗,43011254,2003,https://s.weibo.com/weibo?q=%23放弃治疗而进行临终关怀是不孝吗%23
国产恐怖片还有未来吗,153994488,11470,https://s.weibo.com/weibo?q=%23国产恐怖片还有未来吗%23
如何避免请假耻辱,5751659,186,https://s.weibo.com/weibo?q=%23如何避免请假耻辱%23
你认为云祭扫会代替实地扫墓吗,937785,75,https://s.weibo.com/weibo?q=%23你认为云祭扫会代替实地扫墓吗%23
全身麻醉后你做过梦吗,158543,15,https://s.weibo.com/weibo?q=%23全身麻醉后你做过梦吗%23
